,Title
1381,Anti-Vaccination Movement & Dunning-Kruger Effect | Vaccine Hesitancy
1382,Harold Shipman (Doctor Death) | Mental Health & Personality
1383,Ted Kaczynski (Unabomber) | Mental Health & Personality | MMPI Results
1384,10 Subtle Signs of Narcissism Exposure
1385,Darlie Routier Case | Mental Health & Personality | Guilty or Innocent?
1386,Can the Coronavirus Pandemic Cause PTSD?
1387,Susan Smith Murder Case | Dependent vs. Cluster B Personality
1388,Richard Ramirez (Night Stalker) | Mental Health and Personality | Pure Psychopathy?
1389,Bill Gates Coronavirus Conspiracy Theory Analysis | Dangers of Misinformation | Event 201 & ID2020
1390,What makes someone attractive? | Romantic Attraction and Similarity
1391,Pathological Vulnerable Narcissism Case Study | Battle Between Grandiose and Vulnerable Narcissism
1392,What is Delusional Disorder? | Comprehensive Review | Schizophrenia Controversy
1393,"Lizzie Borden Case | Mental Health, Personality, & Psychopathy"
1394,"Selfies, Narcissism, and Personality | Do Selfies Predict Narcissism?"
1395,Gary Ridgway | Green River Killer | Mental Health & Personality
1396,Slender Man Case | Shared Psychotic Disorder (Folie à deux)
1397,"Coronavirus Q & A with Virologist Dr. Ken Rosenthal | Covid 19 Vaccine, Immunity, and Treatment"
1398,What are Misidentification Delusions? | Why do people see strangers in the mirror?
1399,Phil Hartman Murder | Mental Health and Personality Factors
1400,Invisible Man Movie Analysis | Narcissistic Manipulation on a New Level
1401,Deadly Effect of Personality During the Pandemic | Does the Dark Triad Impede Social Distancing?
1402,Shared Psychotic Disorder & Mystical Delusions | Folie à deux
1403,Tiger King Analysis | Mental Health and Personality Factors
1404,"Pandemic Anxiety | Personality, Psychopathology, Philosophy, and Statistics"
1405,"Dark Humor, IQ, & Once Upon a Time in Hollywood"
1406,"Long-Term Effects of Manipulation | Rejection, Emotional Numbness, and Personality Disorders"
1407,Hoarding Disorder Case Study
1408,Pathological Love and Pathological Jealousy | Are They Related to Cluster B?
1409,"David Icke, 5G, and the Pandemic | Mental Health & Conspiracy Theories"
1410,Humor and Comic Styles with Cluster B Personality Pathology
1411,DID Switching Channels | Trisha Paytas & DissociaDID
1412,"Mental Health of Jimmy McGill | ""Saul Goodman"" from Better Call Saul"
1413,"Coronavirus Q & A | Covid 19 Vaccine, Vectors, Modes of Transmission"
1414,David Icke Coronavirus Conspiracy Theory | The Danger of Covid 19 Misinformation
1415,Wired for Social Distance? | Pathogen Disgust and Personality
1416,10 Signs of Communal Narcissism
1417,Trisha Paytas Video Critique | Dissociative Identity Disorder and Multiple Personality Disorder
1418,Contamination Type OCD | Does a Pandemic Worsen Obsessive Compulsive Disorder?
1419,Therapist with Personality Disorders Case Study | Cluster B Boundary Violations
1420,Jussie Smollett Case | Mental Health and Personality | Victim Narcissist?
1421,Histrionic Personality Disorder Deep Dive | What is Hysteria?
1422,Detecting a Fake Smile | Why is Faking a Smile Harmful?
1423,Autism Spectrum Disorder and Personality Disorders
1424,Can Introverts Be Happy Without Becoming Extraverts? | Extraversion Deficit Belief
1425,"10 ""Dr. Phil"" Mistakes That We Can Learn From"
1426,Coronavirus & Mental Health | Is Panic Contagious? | Epidemiology of Novel Coronavirus
1427,Intermittent Explosive Disorder Deep Dive | Is it really Narcissism or Psychopathy?
1428,10 Examples of Narcissistic and Psychopathic Fantasy
1429,How to Spot a Liar | Personality Profile of Credible Liar
1430,"5 Examples of Personality Disorder Thoughts (Antisocial, Narcissistic, Borderline, Paranoid, & OCPD)"
1431,When does the Gray Rock Method Fail? | Narcissism & Detachment Strategy
1432,Empathy with All 10 Personality Disorders | Cognitive vs. Affective Empathy
1433,10 Ways to Manipulate a Narcissist | (Keeping the Peace with a Narcissist)
1434,Case Study - Borderline Personality Disorder with Excitement Seeking
1435,"200,000 Subscribers Video | How does Dr. Grande Regulate Emotions?"
1436,What is Paranoid Personality Disorder? | Comprehensive Review
1437,10 Things Narcissists do to Appear Smarter than They Really Are
1438,10 Antisocial Behaviors and the Thoughts that Cause Them | Antisocial Personality Disorder
1439,10 Things that Narcissists Say | Narcissistic Statements and Corresponding Thoughts
1440,10 Signs of Borderline Personality Disorder Exposure | Effect of BPD on Partners
1441,Case Study: Comorbid Narcissistic and Antisocial Personality Disorders
1442,Can a Counselor have Narcissistic Personality Disorder? | Are there Safeguards in Place?
1443,"Antisocial Personality Disorder | Causes, Course, and Mortality"
1444,3 Examples of Narcissists Who Play the Victim
1445,Johnny Depp-Amber Heard Phone Call Analysis (2nd Leaked Audio)
1446,What is Obsessive-Compulsive Personality Disorder? | Comprehensive Review
1447,10 Ways Narcissism is Contagious | How to Prevent Narcissistic Contamination
1448,Jordan Peterson Update | What is Paradoxical Reaction and Tapering?
1449,10 Borderline & Bipolar Thoughts and Behaviors | BPD vs Bipolar
1450,"Netflix ""Marriage Story"" Analysis | Personality, Realism, & Critique"
1451,Should Therapy Attempt to Convert Vulnerable Narcissists into Grandiose Narcissists?
1452,Johnny Depp-Amber Heard Recording | Insecurity-Anger Link?
1453,"Case Study: Psychopath at Work | ""Successful Psychopathy"""
1454,Thoughts of a Vulnerable Narcissist | 10 Covert Narcissistic Behaviors & Corresponding Thoughts
1455,Avoidant Personality Disorder | Comprehensive Review
1456,Attachment Styles and Personality Disorders | What is Attachment Theory?
1457,Case Study: Schizoid Personality Disorder | Cluster A Personality Pathology
1458,8 Signs of the Most Destructive Narcissistic Profile
1459,Why Do Beautiful People Earn More Money? | Beauty Premium or Ugliness Penalty?
1460,Borderline Thinking | 10 Borderline Behaviors and the Thoughts that Cause Them
1461,Morning & Evening People Personality | What is a Chronotype? (Circadian Preference)
1462,Case Study: Narcissism and Snapping | When the Narcissist Loses Control
1463,Aaron Hernandez Case | Netflix: Killer Inside | CTE vs. Personality Disorder
1464,Does Counseling Make Narcissism Worse? | Is the Narcissism Epidemic Real?
1465,Personality Disorders & Intelligence | True Difference or Testing Style?
1466,10 Signs of a Mother with Vulnerable Narcissism | Mother-Son Relationship
1467,Why are Beautiful People so Intelligent? | Physical Attractiveness & IQ
1468,10 Signs of a Leader with Dark Triad Traits | 3 Ways to Manage the Dark Triad
1469,"Richard Kuklinski | The ""Iceman"" Mental Health and Personality"
1470,What are Narcissists Really Thinking? | 10 Narcissistic Behaviors and the Thoughts that Cause Them
1471,"Autism Spectrum Disorder, Cluster B Personality Pathology, & Empathy"
1472,Is Intelligence Attractive? | Can Too Much Intelligence Decrease Attraction?
1473,Can Narcissistic Personality Disorder be Treated? | Younger Self Technique for Building Empathy
1474,10 Signs of Daughter with Dependent Personality Traits | Mother-Daughter Relationship
1475,Ed Kemper Case Analysis | Mental Health & Personality Factors
1476,Is the MMPI Unbeatable? | Review of the Minnesota Multiphasic Personality Inventory
1477,10 Signs of a Mother with Narcissistic Traits | Mother-Son Relationship
1478,Is Electromagnetic Hypersensitivity Real? | Chuck McGill Analysis | Better Call Saul
1479,Does Color Preference Really Predict Extraversion? | Who is Destined to be Extraverted?
1480,"Conspiracy Theories, Schizotypy, & Dark Triad Traits | What is a Conspiracist?"
1481,10 Signs of a Mother with Borderline Personality Traits | Mother-Daughter Relationship
1482,What is Michael Scott's Diagnosis? | Mental Health & Personality | The Office
1483,Does Extraversion Lead to Mental Disorders? | Extraversion & Psychopathology
1484,What is the Meaning of Delusions? | Types of Delusions
1485,Good Will Hunting | Analysis of Counseling Scenes
1486,6 Ways Introversion is better than Extraversion | The Upside of Low Extraversion
1487,It's a Wonderful Life | Analysis of George Bailey
1488,10 Signs of a Husband with Avoidant Personality Traits
1489,Case Study: Sudden Gains from Depression | Cognitive Behavioral Therapy
1490,Henry Lee Lucas | Netflix: The Confession Killer | Mental Health & Personality
1491,10 Signs You are Emotionally Immature | Is Emotional Immaturity a Mental Disorder?
1492,Can Society Decrease Narcissism? | Reducing Narcissism as the Narcissist Ages
1493,Do Introverts Really Get Tired from Socializing? | Extraversion & Mental Depletion
1494,10 Signs of a Wife with Vulnerable Narcissistic Traits
1495,10 Signs of a Husband Who is Dangerously Agreeable
1496,"Mass Hysteria in Le Roy, New York? | Mass Psychogenic Illness"
1497,Case Study: Obsessive-Compulsive Disorder (OCD) | Unusual Treatment Strategy
1498,"What is Euthymia? | How Can ""Normal"" be a Disorder?"
1499,The Mandalorian Personality Profile | Five-Factor Model
1500,10 Signs of a Wife with Borderline Personality Traits
1501,What is Conversion Disorder? | Comprehensive Review
1502,Doomsday Preppers: Mental Health and Personality
1503,Elizabeth Holmes Case | Personality & Theranos Fraud
1504,"Case Study: Specified or Unspecified Personality Disorder | OCPD, NPD"
1505,Are Narcissistic Beliefs Ever Delusional? | 3 Narcissistic Behaviors that seem Delusional
1506,"8 Signs you are a ""Shallow Person"""
1507,10 Signs of a Husband with Sadistic Personality Traits
1508,Case Study: Narcissistic Personality Disorder Failed Treatment Attempt
1509,What is Parental Alienation? | Does Parental Alienation Syndrome Exist?
1510,8 Signs of Imposter Syndrome | Related to the Dark Triad?
1511,10 Signs of a Wife with Sadistic Personality Traits
1512,What is Resilience? | How is Resilience Related to Trauma? | Is Resilience a Myth?
1513,What is Hoarding Disorder? | Is it different than OCD and Autism?
1514,Case Study: Rejection and Cluster B Personality Psychopathology
1515,4 Ways to Disarm the Narcissist
1516,INCELS vs. Pickup Artists | Types of INCELS
1517,"Autism, Reactive Attachment Disorder, & Disinhibited Social Engagement Disorder"
1518,"Coping with Unrequited Love | Attraction, Rejection, & Heartbreak"
1519,Is Envy the Worst Narcissistic Trait? | Grandiose vs. Vulnerable Narcissism
1520,The Secret of Becoming Mentally Strong | What is Mental Strength?
1521,Does Joker have Pseudobulbar Affect? | Pathological Laughter & PBA
1522,10 Signs of a Husband with Psychopathic Traits
1523,Presentation Example: Depression & Isolation | Strategic Therapy
1524,Breaking Bad Character Analysis: Walter White | Mental Health & Personality
1525,7 Reasons Narcissism is Pernicious
1526,"Should Child Support be Abolished? | Myth of the ""Deadbeat Dad"""
1527,12 Signs a Romantic Partner May Reject You
1528,"How to Attract Someone ""Out of Your League"" | Online Dating & Desirability"
1529,10 Signs of a Wife with Psychopathic Traits
1530,Analysis of Justine Damond Case | Blue Wall of Silence & Murder
1531,"Trauma Bonding Presentation Example | Borderline, Narcissism, & Lack of Insight"
1532,How Can a Narcissist Change? | Is Lack of Insight Invariable?
1533,10 Signs Someone is Repulsed by You
1534,Joker (2019) | Mental Health and Personality Analysis
1535,Staying with or Leaving the Narcissist? | Stay/Leave Decision
1536,5 Signs Someone is Attracted to You
1537,10 Signs of a Husband with Narcissistic Traits
1538,Botham Jean Murder Case | Did Amber Guyger Act with Intent or Negligence?
1539,"Moderate ""Men Going Their Own Way"" | Is it Logical Given Grim Marriage Statistics?"
1540,How Does Borderline Change Over Time? | Clinical Staging & Course
1541,Grandiose Narcissism and Shame
1542,Jordan Peterson Rehab | Dangers of Benzodiazepine Withdrawal
1543,Aging Narcissist | Do narcissists change as they grow older? | Can they still cause harm?
1544,"Nichol Kessinger - Guilt, Infidelity, & Personality"
1545,What if both people in a romance are narcissists? | Are narcissists attracted to each other?
1546,Friends Sitcom | Personality Rankings of the Characters
1547,10 Signs of a Wife with Narcissistic Traits
1548,Can you spot a psychopath by looking at their eyes?
1549,Aileen Wuornos | First Predatory Female Serial Killer
1550,"Forgiving the Narcissist | Empathy, Rejection, and Negativity"
1551,Can Someone with Borderline Love Others? | Triangular Theory of Love
1552,5 Characteristics of the Narcissist's Lies
1553,Borderline Personality Disorder in Men
1554,"Treating Narcissism Exposure | ""Wrong Turn"" Theory"
1555,Sybil & Dissociative Identity Disorder | Did Sybil Create Multiple Personality Disorder?
1556,What is Dependent Personality Disorder? | Comprehensive Review
1557,Can a Narcissist Love Others? | Love Bombing & Triangular Theory of Love
1558,Is the Joker's Mental Health and Personality Profile Possible in Real Life?
1559,10 Signs of Vindictive Narcissism
1560,Presentation Example: Avoidant Personality Disorder | Attachment & Psychodynamic Therapy
1561,Criticisms of Psychiatry | Counselors vs. Psychiatrists
1562,How to talk someone out of a bad idea | Bad decision examples
1563,Presentation Example: Posttraumatic Stress Disorder (PTSD)
1564,10 Signs of a Daughter with High Trait Narcissism
1565,Case Study: Borderline Personality Disorder
1566,Counselors Who Rebel Against the System | Renegade Therapists
1567,Sneaky Ways to Detect Narcissism? | Overclaiming Bias & Foils
1568,Case Study: Dissociative Identity Disorder | Differentiating from Malingering
1569,Narcissism & No Contact | Is avoiding relationships with narcissists cruel?
1570,Obsessive-Compulsive Disorder & OCPD Presentation Analysis
1571,Is Complex PTSD different than Comorbid BPD & PTSD?
1572,Pick Up Lines & Personality | Which Lines are the Most Effective?
1573,Case Study - Origin of Narcissistic Personality Disorder
1574,Autism Spectrum Disorder and Violence
1575,"Avoidant Personality Disorder, Borderline, & Unstable Emotions | AvPD vs. BPD"
1576,5 Reasons Why You Still Love the Narcissist
1577,ICD vs. DSM | Mental Disorder Classification Manuals
1578,"Differences between Anorexia, Bulimia, Atypical Anorexia, Purging Disorder, & Binge Eating Disorder"
1579,9 Signs of Narcissistic Rage | Reactive & Instrumental Anger
1580,Four Types of Borderline Mother / Daughter Relationships | Maternal Borderline Personality Disorder
1581,What are the thoughts of a Narcissist? | Grandiose vs. Vulnerable
1582,What is the Dark Tetrad? | Has the Dark Triad been replaced?
1583,Jaclyn Glenn - Eugenia Videos | Involuntary Treatment & Eating Disorders
1584,Did Shane Dawson Get It Right? | Eugenia Interview & Eating Disorders
1585,7 Signs of a Narcissistic Father | Father/Son Relationship
1586,Chris Watts - Nichol Kessinger Emails | Cluster B personality pathology?
1587,Is ADHD Treatment Effective? | Counseling vs. Psychiatry
1588,7 Signs of a Narcissistic Father | Father/Daughter Relationship
1589,"Harold Fish Murder Case & the Dark Triad | Narcissism, Psychopathy, & Machiavellianism"
1590,Nine Signs of the Narcissistic Mother | Mother-Daughter Relationships
1591,How to kindly reject a romantic advance | Rejection-Sensitivity & Narcissism
1592,10 Symptoms of a Toxic Personality | Is Toxic Personality Disorder real?
1593,Is Dark Intelligence Real? | Do narcissists & psychopaths have dark emotional intelligence?
1594,Nine Features of the Narcissist / Borderline Couple | Romance & Personality Disorders
1595,How does Empowerment & Stigma Affect Clinical & Personal Recovery?
1596,Fatal Attraction Syndrome | Borderline Personality Disorder & Stalking
1597,Why do people stay with narcissists? | Effective narcissistic manipulation
1598,"David Icke, Lizard People, & Conspiracy Theories"
1599,What is Sugar Dating? (Sugar Daddy) | MacKenzie Lueck Murder Case
1600,Does Narcissism Exposure Cause Depression? | Narcissism Exposure at Work
1601,Can you tell if someone is depressed from their voice? | Vocal Prosody & Depression
1602,Narcissists' Flying Monkeys | Motive & Personality Profile
1603,What is a Nervous Breakdown? | Is it a mental disorder?
1604,"Repelling a Vulnerable Narcissist | Borderline, Histrionic, & Dependent Traits"
1605,Borderline Personality Disorder & Crying | Is Crying Useful Diagnostically?
1606,How do you repel a Narcissist? | (without repelling everyone)
1607,Was Chris Watts a Rage-Type Murderer? | Does Pent-Up Rage Lead to Murder?
1608,Do Personality Disorders increase the risk of dying? | Personality Pathology & Mortality
1609,Nine Signs of Narcissism Exposure
1610,"Sexual Economics Theory vs. Feminist Theory | MGTOW, INCEL, & Science"
1611,Emotional Abuse & Narcissistic Abuse | Is there a difference?
1612,"Was Jeffrey Dahmer Borderline, Psychopathic, & Psychotic at the same time?"
1613,Why Narcissists Win the War of Attrition | Discovering a Narcissist may not matter
1614,What is an INCEL? | Involuntarily Celibate Mental Health & Personality
1615,Sarah Marie Johnson | Double Parricide by an Adolescent Female
1616,Are Married People Better Off? | Is the MGTOW Argument Against Marriage Rational?
1617,Can a person with a personality disorder become a counselor?
1618,Malignant Narcissism | Is it Narcissism and Psychopathy together?
1619,Is Cowardice a Crime? | Former Deputy Scot Peterson - Parkland Shooting
1620,"Is ""Men Going Their Own Way"" a Conspiracy Theory? | MGTOW Community Personality Profile"
1621,How to Appear to be an Empathic Listener
1622,How does the Narcissist Cause Self-Hatred in Victims?
1623,How to Tell the Difference Between Borderline Personality Disorder & Bipolar Disorder
1624,Is Mental Illness a Deal Breaker for Romantic Relationships?
1625,How to tell if you are in a Toxic Relationship | 7 Signs of Relationship Toxicity
1626,Can Science Prove Michael Jackson's Innocence? | Leaving Neverland
1627,Empathic Vampires & Empathic Sadism | Related to Narcissism & Psychopathy?
1628,How Should Game of Thrones have Ended Based on the Character Personalities?
1629,Behind the Curve | 7 Myths about the Flat Earth Movement
1630,Is Tony Robbins a Fraud? | BuzzFeed Allegations & Bad Mental Health Advice
1631,Steven Avery Murder Case | Did the police frame Avery?
1632,Narcissism in Mother-in-law/Daughter-in-law relationships
1633,West Memphis Three Murder Case | Was Justice Served?
1634,Is Borderline Abuse Real? | Borderline Personality Disorder & Aggression
1635,Narcissistic Wounded Hero Counselor & Compassion Fatigue | Trauma-Seeking Clinician
1636,Leaving Neverland | Was Michael Jackson Guilty?
1637,Chris Watts' Appeal | Mental Health Effects of Life Without Parole
1638,How to Unlock Your Inner Narcissist | Coping with Criticism
1639,How Can Men Appear More Attractive to Women?
1640,Is Stockholm Syndrome the same as Trauma Bonding?
1641,Is Denial Just Another Term for Delusion? | Is it a Moral Defect?
1642,Ted Bundy Chi Omega Murders | Theories of Mania & Psychopathy
1643,Attraction to Chris Watts & Ted Bundy? | Personality of Women Romantically Interested in Killers
1644,"10 Signs of Vulnerable Narcissistic Abuse | The ""Dark Cloud"" Theory of Covert Narcissism"
1645,"Which Type of Psychotherapist is the Best? | Counselors, Social Workers, Psychologists, or MFTs"
1646,What Happens if a Client Confesses to Murder? | Counselor Limits of Confidentiality
1647,Did Gypsy Rose Manipulate Nicholas Godejohn? | Was Godejohn's Sentence Fair?
1648,"Sexual Homicide Types | Narcissistic, Schizoid, & Antisocial Personality Disorders as Risk Factors?"
1649,"Treating ""Borderline Woman - Psychopathic Man"" Couples | Clinical Challenges"
1650,Can a Romantic Breakup Cause PTSD? | Why Mental Disorder Definitions Matter
1651,"Female Attraction to Psychopaths? | Did Jordan Peterson Misinterpret ""A Billion Wicked Thoughts?"""
1652,Chronic Suicidality | Strategies & Challenges for Treatment & Prevention
1653,"Are Internet Trolls Psychopathic? | Sadistic, Narcissistic & Antisocial Personality"
1654,10 Signs of Grandiose Narcissistic Abuse
1655,Tarasoff Murder Case | Duty to Warn vs. Duty to Protect
1656,Gypsy Rose Blanchard Murder Case | Münchausen Syndrome by Proxy
1657,Grandiose & Vulnerable Narcissism: Which is worse? Is Recovery Possible?
1658,Dr. Phil Show Critique | Is Phil McGraw Good for Mental Health?
1659,Chris Watts vs. Scott Peterson | Adultery & Murder (Uxoricide)
1660,Jordan Peterson Critique | Philosophical Genius?
1661,Narcissistic & Psychopathic Emotional Manipulation | Can it be avoided?
1662,Scott Peterson Murder Case | Did bad science convict the wrong person?
1663,"Chris Watts - Familicide Type: Immortality, Control, Suicide, or Revenge?"
1664,How to Reason with a Narcissist | Can they be Persuaded?
1665,Has Joe Biden been too handsy? | Touchy-feely personality vs. behavior
1666,"Jodi Arias Murder Case | Borderline, Narcissistic, or Nothing?"
1667,Passive-Aggressive Personality Disorder | The Lost Personality Disorder
1668,How to Appear Less Creepy | What is the Nature of Creepiness?
1669,Casey Anthony Murder Case | Mental State & Personality | Guilty or Not?
1670,"How do People Come to Believe in Conspiracy Theories | Nature, Formation, & Personality"
1671,Did Nichol Kessinger Manipulate Chris Watts? | Passionate Phase of Romance
1672,How to Appear Less Needy | Approach vs. Avoidance
1673,"Chris Watts | Psychopathy, Narcissism, Rage, Infidelity, & Murder"
1674,Narcissistic Fantasy | Grandiose vs. Vulnerable Narcissism Fantasy Themes
1675,"Menendez Brothers Murder Case, Ethics, & Mental Health"
1676,YouTube Mental Health Channels & Drama | A Dangerous Intersection?
1677,How to Reason with Someone Who is Delusional | Is Delusional Behavior on a Continuum?
1678,Diagnosing Public Figures | Donald Trump / Narcissistic Personality Disorder Controversy
1679,"Female Serial Killers | Nannie Doss ""The Giggling Grandma"""
1680,How Healthy Boundaries Prevent Narcissistic & Psychopathic Manipulation
1681,How to Appear Less Narcissistic
1682,Mercy vs. Justice & The Rewired Soul | Clearing up misconceptions
1683,"Psychopathy, Aggression, Violence, and Murder | Which type of psychopath is more dangerous?"
1684,"Body Language ""Experts"" | Can They Actually Detect Deception?"
1685,The Four Types of Impulsivity | Why is it so destructive?
1686,Myers-Briggs Type Indicator (MBTI) | Is it a Valid Personality Test?
1687,Female High School Teacher Sex Offenders | Are they different than male sex offenders?
1688,"Why do counselors try to prevent suicide? | Does ""Rational Suicide"" exist?"
1689,Should you tell your employer that you are Mentally Ill? | Employment & Discrimination
1690,Personality Disorders and the Insanity Defense | Antisocial Personality Disorder & Psychopathy
1691,"Self-Diagnosis, Psychopathy,  Narcissism, Ted Bundy | Recovery Mum Collaborate"
1692,Mensa & Narcissism? | How Anyone Can Get Into Mensa
1693,Munchausen Syndrome by Proxy | Factitious Disorder Imposed on Another
1694,Neuro-Linguistic Programming | Richard Grannon Spartan Life Coach Channel Critique
1695,Was Ted Bundy actually special? | Netflix: Conversations with a Killer: The Ted Bundy Tapes
1696,"Borderline Personality Disorder & Sexual Compulsivity | Sex Addiction, Hypersexuality, & Promiscuity"
1697,What is Polyamory? | Open Relationships & Consensual Non-monogamous Relationships
1698,Subminimum Wage | Did Philip Defranco get it right?
1699,"Types of Narcissistic Abuse | Exposure, Direct, Insidious, & Emotional Starvation"
1700,Is Infidelity Unavoidable? | Personality and Risk Factors
1701,Subtle Signs of the Dark Triad | Dark Personality Examples
1702,Autism Spectrum Disorder vs. Borderline & Narcissistic Personality Disorders
1703,Psychopathy and Sexual Fantasy
1704,Are there advantages to being mentally ill? Mental Disorder Superpowers
1705,Criticism of the YouTube Narcissism Channels | Are They Helping or Hurting?
1706,Spotting Psychopaths based on Language? | Do Disfluencies point to Psychopathy?
1707,Eight Signs of a Good Counselor / Therapist
1708,Why don't people know when they have a Personality Disorder? | Egosyntonic vs Egodystonic
1709,Four Things that Counselors Don't Know About Social Anxiety Disorder
1710,Recovery From Narcissistic Personality Disorder | How Avoidant Personality Disorder Fits In
1711,Why are Women Attracted to Bad Boys? | Recovery Mum & Dr. Grande Collaboration
1712,"""Rewired Soul"" Channel Criticism | Mental Health Education or Entertainment?"
1713,Materialism and Personality Psychopathology | Different than Oniomania & Compulsive Buying
1714,Worst Personality Disorder for Others | Indirect Exposure to Personality Disorders
1715,11 Signs a Child May Become a Psychopath | Psychopathic Risk Factors
1716,The Dark Triad & Schizotypal Personality Disorder | Schizotypy
1717,Four Things that Counselors Don't Know About Bipolar Disorder
1718,"Blame-shifting & Cluster B Personality Disorders | Antisocial, Narcissistic, Borderline, Histrionic"
1719,What is Malingering? | How do those who fake psychosis get caught?
1720,Is Everyone Mentally Ill? | Accurate Diagnosis or Overpathologizing?
1721,The Link Between Narcissistic & Borderline Personality Disorders | Is there a common factor?
1722,"Spotting the Dark Triad Traits in Faces | Psychopathy, Narcissism, & Machiavellianism"
1723,Six Therapeutic Mistakes that Counselors / Therapists Make
1724,What is the Best Personality Profile? | Optimal Mental Health Personality on FFM
1725,Examples of Delusions | How are Delusions Treated?
1726,How is Machiavellianism different from Psychopathy and Narcissism? | The Dark Triad Traits
1727,Borderline Personality Disorder with Psychosis | Comorbidity or Part of Borderline?
1728,Are Counselors / Therapists More Likely to have Mental Disorders?
1729,Schadenfreude & Narcissism | Joy in the Pain of Others
1730,"The Truth about ""Narcissistic Abuse Syndrome"" | ""Narcisstic Victim Syndrome"""
