,Title
1731,"OCD - OCPD Rage, Anger, & Frustration | Is the Anger Different?"
1732,Friends with Benefits & Borderline Personality Disorder | RecoveryMum & Dr. Grande
1733,Is Narcissism Evil? | Are Narcissists Evil?
1734,How to Tell the Difference Between a Psychopath and a Narcissist
1735,Six Signs of a Bad Therapist (Counselor / Mental Health Clinician)
1736,Do Narcissists Deliberately Make Romantic Partners Jealous? | Narcissistic Jealousy-Induction
1737,Is IQ Important or Insignificant? | Is there any purpose to knowing your IQ score?
1738,Is Borderline Personality Disorder Different for Men and Women?
1739,Are All Decisions Based on Emotions? | Emotion vs. Cognition in Decision-making
1740,What is the Sociopathic Stare? | Is it really a Psychopathic Stare?
1741,What is the Worst Personality Disorder of all Ten Personality Disorders?
1742,"Borderline Personality Disorder and the ""Trail of Destruction"""
1743,Borderline Personality Disorder & Comorbidity | RecoveryMum & Dr. Grande
1744,What are the Differential Diagnoses for Narcissistic Personality Disorder?
1745,"Why Conspiracy Theories are Illogical | Moon Landing, Flat Earth, Global Warming"
1746,Do Mothers with Borderline Cause Borderline in Their Children?
1747,The Flat Earth Movement and Personality
1748,Is Antisocial Personality Disorder Different in Men and Women?
1749,Ebenezer Scrooge's Five Factor Model Personality Profile | Are there Dark Triad Traits?
1750,Can Large Age Difference Relationships Succeed? | May-December Romance
1751,What is Hypersexuality? | Compulsive Sexual Behavior
1752,Borderline Personality Disorder and Anger | RecoveryMum & Dr. Grande
1753,Is Life Coaching a Scam?
1754,What is the Relationship between ADHD and Antisocial Personality Disorder?
1755,Do Narcissists Choose to have Trait Narcissism?
1756,Q & A: Borderline & Relationships | RecoveryMum & Dr. Grande
1757,Is Earning a Ph.D. Worth the Cost? | Master's vs. Ph.D. in Counseling
1758,"Dark Triad and Sexual Fantasies | Narcissism, Psychopathy, Machiavellianism"
1759,What is the Core of Borderline Personality Disorder?
1760,Psychopathy and Intermittent Explosive Disorder
1761,What is High-Functioning Depression? | Is the term needed?
1762,Is there an Easy Way to Detect Narcissism? | Core of Narcissistic Personality
1763,Is Maladaptive Daydreaming a Mental Disorder?
1764,Narcissism Manifestion in Borderline Personality Disorder
1765,What are Paraphilic Disorders?
1766,What is Gelotophobia? | Is it related to Social Anxiety Disorder & Avoidant Personality Disorder?
1767,Humility and Death Anxiety
1768,"Attachment Styles, Borderline, and Narcissistic Personality Disorders"
1769,Q & A: Borderline Personality Disorder | RecoveryMum/Dr. Grande Collaboration
1770,Bipolar Disorder and Creativity
1771,What is Sexual Narcissism?
1772,Borderline Personality Disorder and Emotional Intelligence
1773,What is Gaslighting and Where did the Term Gaslighting Originate?
1774,Why Does High Extraversion Predict Positive Emotions (Happiness)?
1775,Five-Factor Model of Personality and Sexual Behavior
1776,Narcissism and Physical Abuse (Narcissistic Abuse)
1777,Antisocial Personality Disorder vs. Borderline Personality Disorder
1778,What is the Downside of Socially Desirable Personality Characteristics?
1779,Does Watching Television Cause Narcissism?
1780,"Are Emotions Different for Borderline Personality Disorder, MDD, and Bipolar Disorder?"
1781,"Social Anxiety Disorder and Cluster A Personality Disorders (Paranoid, Schizoid, Schizotypal)"
1782,What Causes Alexithymia?
1783,"Co-occurring Disorders, Antisocial Personality Disorder, and Criminal Offending"
1784,"Narcissistic Personality Disorder and the ""Trail of Destruction"""
1785,Betterhelp YouTube Drama: What I Learned from Betterhelp's CEO
1786,Maternal Psychological Control and Borderline Personality Disorder
1787,"Psychopathic Traits, Police, & Heroism (Successul Psychopathy)"
1788,The Dissociative Identity Disorder Controversy (Trauma vs. Iatrogenic)
1789,Does the Full Moon Affect Human Behavior?
1790,Rejection and Rage with Borderline Personality Disorder
1791,Dark Traits vs. Vulnerable Dark Traits (Dark Triad vs. Vulnerable Dark Triad)
1792,What is the Relationship between Borderline Personality Disorder and Shame/Guilt?
1793,Bipolar Disorder and Aggression
1794,Was Kati Morton's Undercover Therapist Role Appropriate or Ethical? (World of Jake Paul)
1795,Borderline Personality Disorder and Emotion Dysregulation
1796,Is Histrionic Personality Disorder Dead?
1797,Borderline Personality Disorder and Meaning in Life
1798,What did Kati Morton get wrong about Antisocial Personality Disorder?  (Shane Dawson Interview)
1799,"Do Negative Life Experiences Cause Avoidant, Dependent & Obsessive-Compulsive Personality Disorders?"
1800,"Psychopathy vs. Antisocial Personality Disorder (sociopath, sociopathic traits, & sociopathy)"
1801,Borderline Personality Disorder and Autism Spectrum Disorder
1802,Do Personality Disorders Predict Negative Life Events (and Positive Life Events)?
1803,Is Borderline Personality Disorder Actually a Trait Disorder?
1804,What is Schema Therapy?
1805,What is Subclinical Psychopathy?
1806,What is Death Anxiety?
1807,The Relationship Between Psychopathy and Intelligence
1808,Treatment Strategies for Borderline Personality Disorder
1809,Examples of Histrionic Personality Disorder Symptom Manifestations
1810,Experiential Avoidance and Obsessive Compulsive Personality Disorder
1811,"Relational Aggression, the FFM, and Personality Disorders"
1812,Narcissism and Romantic Partner Selection
1813,Are Avoidant Personality Disorder and Social Anxiety Disorder Different?
1814,The Nature of Stigma with Social Anxiety Disorder
1815,Does Comorbid Borderline and Substance Use Disorder Worsen BPD Symptoms?
1816,Psychopathy and Moral Judgment
1817,What is the Difference Between Pathological Narcissism and Narcissistic Personality Disorder?
1818,How Do Social Interactions Affect Individuals with Avoidant & Borderline Personality Disorders?
1819,"Psychopathy and Fear Response, Recognition, and Acceptability"
1820,Borderline Personality Disorder and Facial Expression Recognition
1821,What is the Difference Between Primary and Secondary Psychopathy?
1822,Do Personality Disorder Symptoms Predict Divorce?
1823,Seven Myths about Schizoid Personality Disorder
1824,What is the Relationship Between Codependent and Counterdependent Traits and Personality Disorders?
1825,What is the Relationship Between Psychopathy and Emotional Intelligence?
1826,Cluster C Personality Disorders and Shame
1827,Avoidant Personality Disorder and the Recognition of Fear in Others
1828,Personality Traits Diagnostic Model of Personality Disorders in the DSM (Dimensional Model)
1829,What Causes the Anger Component of Borderline Personality Disorder?
1830,"Childhood Maltreatment, Antisocial Personality Disorder, and Psychopathy"
1831,Loneliness and Borderline Personality Disorder
1832,What is the Dark Triad?
1833,"Borderline, Comorbid Borderline and Substance Use Disorder, and Impulsivity"
1834,What is Psychopathy?
1835,What is Emotional Switching with Borderline Personality Disorder?
1836,How Does Borderline Personality Disorder Affect Romantic Relationships?
1837,Mental Health and Science (Dr. Grande's Youtube Channel Trailer)
1838,What is Seasonal Affective Disorder? (Major Depressive Disorder with Seasonal Pattern)
1839,Narcissistic Rage and Vulnerable and Grandiose Narcissism
1840,Countertransference in the Treatment of Narcissistic Personality Disorder
1841,Subtypes of Borderline Personality Disorder (Millon & Others)
1842,What is Somatic Symptom Disorder?
1843,What is Borderline Aggression?
1844,Are Narcissistic Personality Disorder Symptoms Stable Over Time?
1845,What is Codependency?
1846,What is Misophonia?
1847,What is Mania and how is it related to Bipolar Disorder?
1848,Do Personality Disorders Change over the Lifetime?
1849,What is Major Depressive Disorder with Mixed Features?
1850,What are the Associated Characteristics of Narcissistic Personality Disorder?
1851,What is Pathological Lying? (Pseudologia Fantastica)
1852,What is Quiet Borderline Personality Disorder?
1853,What is the Difference Between Borderline Personality Disorder and Histrionic Personality Disorder
1854,Complicating Factors for Treatment of Antisocial Personality Disorder
1855,Cognitive Behavioral Strategies for Narcissistic Personality Disorder
1856,"What is the ""Fear of Abandonment"" Associated with Borderline Personality Disorder?"
1857,Six Myths about Narcissistic Personality Disorder
1858,What is Melancholic Depression?
1859,Nine Myths about Schizophrenia
1860,What is the Course of Major Depressive Disorder?
1861,What is Splitting with Borderline Personality Disorder?
1862,What is Atypical Depression?
1863,Do the Symptoms of Borderline Personality Disorder Change with Age?
1864,What is Illness Anxiety Disorder?
1865,"Oppositional Defiant Disorder, Conduct Disorder, & Antisocial Personality Disorder"
1866,Nine Myths about Borderline Personality Disorder
1867,The Course of Bipolar Disorder
1868,Five Myths about PTSD
1869,Examples of Narcissistic Personality Disorder Symptom Manifestations
1870,Opinions about the Diagnostic and Statistical Manual (DSM)
1871,Text Therapy vs. Traditional Face-to-Face Therapy
1872,What is the Difference Between Schizoid Personality Disorder and Antisocial Personality Disorder?
1873,What is Secondary Traumatic Stress?
1874,Seven Myths about Antisocial Personality Disorder
1875,Summary of all 10 Personality Disorders
1876,What is the Relationship between Mental Health Disorders and Violence?
1877,Examples of Schizotypal Personality Disorder Symptom Criteria Manifestations
1878,What is the Difference Between Borderline Personality Disorder and Complex PTSD (C-PTSD)?
1879,What is the Highly Sensitive Person Construct? (Sensory Processing Sensitivity)
1880,What is Pica? (Eating Nonfood Substances)
1881,What is the Difference Between PTSD and Complex PTSD (C-PTSD)?
1882,What is Synesthesia?
1883,What are the Risk Factors for Intermittent Explosive Disorder (IED)?
1884,What is the Difference Between Schizotypal Personality Disorder and Schizophrenia?
1885,What is the difference between Paranoid Personality Disorder and Schizoid Personality Disorder?
1886,What is Conduct Disorder?
1887,What are the Types of Borderline Personality Disorder?
1888,Does Television Viewing Increase the Risk of Antisocial Personality Disorder?
1889,What is the Difference Between Narcissistic and Obsessive Compulsive Personality Disorders?
1890,What is Dependent Personality Disorder?
1891,Self-Disclosure as a Technique in Counseling
1892,What are the Emotional and Cognitive Characteristics of Antisocial Personality Disorder?
1893,Driving Styles and Personality Traits
1894,What is the difference between Paranoid Personality Disorder and Avoidant Personality Disorder?
1895,What is Obsessive-Compulsive Personality Disorder?
1896,What Causes Antisocial Personality Disorder? (Etiology & Risk Factors)
1897,"What is Purely Obsessional (""Pure O"") Obsessive Compulsive Disorder? (Primarily Cognitive OCD)"
1898,What is Dialectical Behavior Therapy (DBT)?
1899,What is Adjustment Disorder?
1900,Six Myths about Obsessive Compulsive Disorder
1901,What is Borderline Rage? (Borderline Personality Disorder Anger)
1902,Seven Myths about Major Depressive Disorder
1903,What is Depersonalization Derealization Disorder?
1904,What is Maladaptive Daydreaming?
1905,Eight Myths about Panic Attacks
1906,What is the difference between Avoidant Personality Disorder and Dependent Personality Disorder?
1907,Grandiose vs. Vulnerable Narcissism
1908,Psychotic Depression vs  Nonpsychotic Depression
1909,Narcissistic Personality Disorder and Emotional Processing
1910,What Causes Aggressive Driving?
1911,"What is the Difference Between Acute, Chronic, and Complex Trauma?"
1912,What is the difference between Avoidant Personality Disorder and Narcissistic Personality Disorder?
1913,What is Alexithymia? (Inability to Express or Recognize Emotions)
1914,What is the Schizophrenogenic Mother?
1915,What are Paranoid Delusions (Persecutory Delusions)?
1916,What is Avoidant Personality Disorder? (AVPD)
1917,What are Counting Rituals in Obsessive-Compulsive Disorder (OCD)?
1918,What is an Existential Obsession (Philosophical Obsession) in Obsessive Compulsive Disorder (OCD)?
1919,What Causes Narcissistic Personality Disorder?
1920,Criticisms of Beckian Cognitive Therapy
1921,What are Hit and Run Obsessions in Obsessive-Compulsive Disorder? (MVA OCD)
1922,What are Flashbacks? (Posttraumatic Stress Disorder [PTSD] - Intrusion Symptom)
1923,Which Disorders are Comorbid with Borderline Personality Disorder?
1924,What Causes Avoidant Personality Disorder?
1925,What is Solution-Focused Therapy? (Solution-Focused Brief Therapy)
1926,What is Major Depressive Disorder?
1927,What is Psychoanalytic Theory (Psychoanalysis)?
1928,What are Repressed Memories and are they real?
1929,Rational Emotive Behavior Therapy vs. Cognitive Therapy? (REBT vs .CT)
1930,What is Motivational Interviewing?
1931,Is Major Depression Overdiagnosed or Underdiagnosed?
1932,What is Cognitive Therapy? (Beckian Therapy)
1933,What is Reality Therapy? (Choice Theory)
1934,"Sensitivity, Specificity, False Positive Rate, and False Negative Rate"
1935,What is Social Anxiety Disorder?
1936,What is Rational Emotive Behavior Therapy (REBT)?
1937,What is Narrative Therapy?
1938,What are the Limitations and Criticisms of Person Centered Therapy?
1939,What are Existential Therapy and the Existential Crisis?
1940,The Six Facets of Agreeableness (Five Factor Model of Personality Traits)
1941,The Four Schedules of Reinforcement in Behaviorism
1942,What is Adlerian Therapy?
1943,What is Behavior Therapy?
1944,The Six Facets of Neuroticism (Five Factor Model of Personality Traits)
1945,What is Analytic Psychology? (Jungian Therapy)
1946,"ADHD, Predominantly Hyperactive / Impulsive Subtype"
1947,The Six Facets Facets of Conscientiousness (Five Factor Model of Personality Traits))
1948,Is the Hawthorne Effect a Myth?
1949,What is Gestalt Therapy?
1950,The Six Facets of Openness to Experience (Five Factor Model)
1951,What are the differences between False Consensus Effect and Projection?
1952,"What are Emotions, Feelings, Affect, and Mood?"
1953,"ADHD, Predominantly Inattentive Subtype"
1954,The Six Facets of Extraversion (Five Factor Model of Personality)
1955,What is Cognitive Dissonance Theory?
1956,What is Sublimation? (Freudian Defense Mechanism)
1957,What is Bipolar Disorder with Rapid Cycling?
1958,What is Pyromania?
1959,"The Relationship Between Intelligence, Conscientiousness, and Success"
1960,What is Oppositional Defiant Disorder?
1961,What is Nightmare Disorder?
1962,"What are the Symptoms of Sedative, Hypnotic, or Anxiolytic Withdrawal?"
1963,How do the Five Factor Personality Traits Affect Career Success?
1964,What is the Difference Between Schizoaffective Disorder and Schizophrenia?
1965,Is the Rorschach Ink Blot Test Valid?
1966,What are the Attachment Styles?
1967,Features of Extreme Personality Traits (Five Factor Model)
1968,What is the Difference Between Avoidant Personality Disorder and Schizoid Personality Disorder?
1969,What is Hypersomnolence Disorder?
1970,What is the Dunning-Kruger Effect?
1971,What is the Difference Between Schizophreniform Disorder and Schizophrenia?
1972,What is the Difference Between Borderline Personality Disorder and Bipolar Disorder?
1973,What is Kleptomania?
1974,PTSD Combinations Supplemental Video Calculations
1975,How many Combinations of PTSD Criteria are there?
1976,What is the Difference Between DSM Subtypes & Specifiers?
1977,The Relationship between the Five-Factor Model and Mental Health Disorders
1978,What is Anhedonia?
1979,Can Nonverbal Communication Reveal Deception?
1980,"Epidemiology, Etiology, and Risk Factors in Mental Health"
1981,What are the Etiological and Risk Factors for Borderline Personality Disorder?
1982,What is Misattribution of Arousal?
1983,Is the 93% - 7% Rule of Nonverbal and Verbal Communication True?
1984,What is Non Rapid Eye Movement (REM) Sleep Arousal Disorder?
1985,Can Violence be Predicted with the Macdonald Triad? (Homocidal Triad)
1986,"What is the Theory of Needs (Achievement, Power, Affiliation)?"
1987,What is Severe and Persistent Mental Illness?
1988,What is the Difference Between Acute Stress Disorder and Posttraumatic Stress Disorder?
1989,What is the Difference Between Borderline Personality Disorder & Narcissistic Personality Disorder?
1990,What is Anosognosia?
1991,Do Subliminal Messages Affect Human Behavior?
1992,Bias in Research
1993,Does Controlled Aggression in Therapy Reduce Anger?
1994,What is Schizotypal Personality Disorder?
1995,What is the difference between Antisocial Personality Disorder & Narcissistic Personality Disorder?
1996,Does Birth Order Affect Personality Traits?
1997,What are the Symptoms of Schizophrenia?
1998,Is Primal Therapy Effective?
1999,What is Autism Spectrum Disorder?
2000,What is Social (Pragmatic) Communcation Disorder?
2001,Is Borderline Personality Disorder Actually a Personality Disorder?
2002,What is the Actual Probability that a Marriage Will End in Divorce?
2003,What is Histrionic Personality Disorder?
2004,What is Antisocial Personality Disorder?
2005,What is Paranoid Personality Disorder?
2006,What is Disruptive Mood Dysregulation Disorder?
2007,What is Female Orgasmic Disorder?
2008,Should Alcohol be Illegal?
2009,What is the difference between Schizoid Personality Disorder and Schizotypal Personality Disorder?
2010,What is Binge Eating Disorder?
2011,How are Personality Traits and Marital Satisfaction Related?
2012,What is Cyclothymic Disorder?
2013,What is the difference between Persistent Depressive Disorder and Major Depressive Disorder?
2014,Do Lie Detectors (Polygraphs) Really Work?
2015,What is Neuroticism? (Five Factor Model of Personality)
2016,What is the difference between Dependent Personality Disorder and Borderline Personality Disorder?
2017,What is Trichotillomania (Hair-Pulling) Disorder and how is it different from OCD?
2018,What is Conscientiousness?
2019,What is Openness to Experience?
2020,The Advantages of Being Disagreeable (Low on the Agreeableness Personality Trait)
2021,"What are the Differences Between Somatic Symptom Disorder, Factitious Disorder, & Malingering?"
2022,Can Video Games Cause or Worsen PTSD?
2023,What is Conversion Disorder?
2024,What is Narcissistic Personality Disorder?
2025,"The Five-Factor Model of Personality Traits aka ""The Big Five"""
2026,The PTSD Definition Controversy - What is a Qualifying Trauma?
2027,What is Schizoid Personality Disorder?
2028,Is Positive Thinking Necessary?
2029,What is the difference Bulimia Nervosa and Binge Eating Disorder?
2030,What is Intermittent Explosive Disorder?
2031,Is the ADHD Epidemic Real?
2032,What is Borderline Personality Disorder?
2033,What is Gambling Disorder?
2034,The Role of Science in Counseling
2035,What is the difference between Guilt and Shame?
2036,Is Dissociative Identity Disorder Real?
2037,What is the difference between Somatic Symptom Disorder and Illness Anxiety Disorder?
2038,Is the Eye Movement Element of EMDR Effective?
2039,What is the difference between Introversion and Extroversion?
2040,Process Addiction vs. Substance Use Disorder
2041,Positive and Negative Reinforcement and Punishment
2042,Mechanisms of Anger and Outbursts of Anger
2043,What is Agoraphobia?
2044,What is Selective Mutism?
2045,What is the Disease Model of Addiction?
2046,What is the Difference between Anorexia Nervosa and Bulimia Nervosa?
2047,What is the Expectancy Theory of Motivation?
2048,What is the difference between Nightmares and Night Terrors?
2049,Does Unipolar Mania Exist as a Distinct Construct in Mental Health?
2050,What is the Meaning of Dreams?
2051,What is the difference between Obsessions and Compulsions?
2052,Differences between Obsessive-Compulsive Disorder and Obessive-Compulsive Personality Disorder
2053,What is the difference between Transference and Countertransference?
2054,What is the difference between Bipolar I Disorder and Bipolar II Disorder?
2055,What is the difference between Avoidant Personality Disorder and Social Anxiety Disorder?
2056,What is the difference between Social Anxiety Disorder and Panic Disorder?
2057,What is an IQ Score (Intelligence Quotient)?
2058,Three Core Conditions in Counseling - Carl Rogers' Person Centered Therapy
2059,What are the Differences Between Depression and Sadness?
2060,Empathy vs. Sympathy in Counseling
2061,What is the Placebo Effect?
2062,What is Posttraumatic Stress Disorder (PTSD)?
2063,"Sigmund Freud's Structure of Personality: the Id, Ego, and Superego"
2064,What is a Probability Value (p-value) in Inferential Statistics?
2065,What is the Difference Between Sociopathy and Psychopathy?
2066,"Separate First Name, Middle Initial, and Last Name into Different Variables using Excel"
2067,"Understanding AND, OR, & NOT Statements with Independent Probabilities using Excel"
2068,Calculate Number of Trials to Reach a Specified Probability of Occurrence using Excel
2069,Convert Odds to Probability and Probability to Odds using Excel
2070,Calculate Probability that Independent Events Will Occur or Not Occur using Excel
2071,"Calculating the Sum of Squares Between Groups, Within Groups, and Total using Excel"
2072,Understanding and Calculating Power after Two-Way ANOVA using SPSS
2073,Absolute and Relative References in Excel
2074,Conducting the Runs Test using Excel
2075,Kuder Richardson 20 (KR-20) in Excel
2076,Bonferroni Correction and Holm Method (Post Hoc Tests) after one-way ANOVA in Excel
2077,Tukey-Kramer Post Hoc Test after One-Way ANOVA in Excel
2078,Scheffe Test (Post Hoc Test) after ANOVA in Excel
2079,Calculate Omega Squared after One-Way ANOVA using SPSS and Excel
2080,Calculate Eta-Squared Effect Size after ANOVA using Excel
2081,Kolmogorov-Smirnov Test of Normality in Excel
2082,Significance vs. Effect Size for One Way ANOVA using SPSS
2083,CBT Counseling Role-Play - Clients with Symptoms of Borderline Personality Disorder
2084,Transpose Data in SPSS to Prepare Variables for Analysis
2085,Conducting the Runs Test using SPSS
2086,Introduction to Multiple Linear Regression
2087,Push Data from Excel to MS Word Content Controls using Excel VBA
2088,Copy Data from Microsoft Word to Excel using Excel VBA
2089,Recording the Time to Complete a Task using Excel VBA
2090,Selecting the Correct Inferential Statistic
2091,Introduction to McNemar's Test
2092,Introduction to the Cochran's Q Test
2093,Choosing Between the Kolmogorov-Smirnov and the Shapiro-Wilk Tests of Normality using SPSS
2094,Introduction to Point-Biserial Correlation
2095,Introduction to Friedman's Analysis of Variance by Ranks
2096,Understanding and Calculating Excpected Values for Chi-Square in Excel and SPSS
2097,Understanding and Producing Z Scores using Excel
2098,Test Variable for Normality with a Q-Q Plot (Quantile-Quantilte Plot) in Excel
2099,Introduction to Simple Linear Regression
2100,Introduction to the Chi-Square Test
2101,Select a Specified Cell from a Range using Excel VBA
2102,Reorder Items in a ListBox Control using Excel VBA
2103,Search a ListBox Control using a TextBox Control in Excel VBA
2104,Clear All TextBox Controls on a UserForm and in a Frame Control
2105,Add a Clock to a UserForm using Excel VBA
2106,Interpreting Percentages from a Chi-Square Test Crosstabulation Output Table in SPSS
2107,Introduction to Two-Way Multivariate Analysis of Covariance (Two-Way MANCOVA)
2108,Introduction to One-Way Multivariate Analysis of Covariance (One-Way MANCOVA)
2109,Introduction to Two-Way Multivariate Analysis of Variance (Two-Way MANOVA)
2110,Introduction to One-Way Multivariate Analysis of Variance (One-Way MANOVA)
2111,Introduction to Two-Way Analysis of Covariance (Two-Way ANCOVA)
2112,Family Counseling Role-Play - Couple Struggling with Decision of Having a Child - Session 3
2113,Introduction to One-Way ANCOVA
2114,Testing the Assumptions for the Wilcoxon Signed-Rank Test in SPSS
2115,Introduction to the Wilcoxon Signed-Rank Test
2116,Introduction to the Kruskal-Wallis H Test
2117,Introduction to the Mann-Whitney U Test
2118,Behavioral Therapy Counseling Role-Play - Client with Symptoms of Narcissistic Personality Disorder
2119,Split-Plot ANOVA (Mixed-Design Two-Way Repeated Measures ANOVA) in SPSS
2120,Introduction to Two-Way Repeated Measures ANOVA (Two-Way Within-Subjects Design)
2121,Two-Way Repeated Measures ANOVA (Two Within-Subjects Factors) using SPSS
2122,"Introduction to Two-Way Mixed ANOVA (Split-Plot ANOVA, SPANOVA)"
2123,Family Counseling Role-Play - Couple Struggling with Independence vs. Security
2124,Introduction to One-Way Repeated Measures ANOVA (Within-Subjects ANOVA)
2125,Introduction to the Two-Way Analysis of Variance (Two-Way ANOVA)
2126,Introduction to the One-Way Analysis of Variance (ANOVA)
2127,Introduction to the Dependent-Samples T Test
2128,Family Counseling Role-Play - Relational Problems with Couple and Daughter - Part 4
2129,Introduction to the Independent-Samples T Test
2130,Message Box that Automatically Closes After Specified Period of Time using Excel VBA
2131,Family Counseling Session Role-Play - Couple with Different Goals and Age Difference
2132,Pretest and Posttest Analysis with ANCOVA and Repeated Measures ANOVA using SPSS
2133,Family Counseling Session Role-Play - Couple Struggling with Decision of Having a Child - Session 2
2134,Make a Cell Flash a Specified Number of Times with Specified Colors using Excel VBA
2135,Family Counseling Role-Play - Relational Problems with Couple and Daughter - Part 3
2136,Point-Biserial Correlation with Multiple Dichotomous Variables using SPSS
2137,Family Counseling Role-Play - Relational Problems with Couple and Daughter - Part 2
2138,Family Counseling Role-Play - Relational Problems with Couple and Daughter - Part 1
