,Title
0,Unfaithful Wife Enters Haphazard Conspiracy with New Lover | Nikki Sue Entzel Case Analysis
1,City Councilman with Troubled Past Ends Career on a High Note | Matthew Reilly Case Analysis
2,"Dark Triad Traits, Sex Drive, and Sexual Fantasies #shorts"
3,"Stalker Hides in Attic of OnlyFans ""Talent"" | Mauricio Guerrero Case Analysis"
4,What is Relationship Obsessive Compulsive Disorder (ROCD)? #shorts
5,Family Survives After Tesla Travels Off Cliff | Dharmesh Patel Case Analysis
6,Narcissism and Daily Conversation Word Selections #shorts
7,Unusual Kidnapping Reveals Shocking Mental Health History | Cleo Smith Case Update and Analysis
8,How Narcissists Use Projection in Arguments #shorts
9,Gravely Ill 'Trespasser' Dies After Being Arrested at Hospital | Lisa Edwards Case Analysis
10,Romantic Attachment Styles and Borderline Personality Disorder #shorts
11,Is Barry Morphew Innocent After All? | Suzanne Morphew Case Analysis | Dangers of Chipmunk Alibis
12,Extraversion and Reactive Aggression #shorts
13,Surgeon Dies After Being Defrauded by Yoga Studio Operators | Mark Sawusch Case Analysis
14,Corporate Title Inflation and Narcissism #shorts
15,Killer Priest Protected by Conspiracy to Boost JFK | Irene Garza Case Analysis
16,One Obvious Narcissistic Tactic in Response to Failure #shorts
17,Man Starts New Life After Killing Parents to See Girlfriend | William Leslie Arnold Case Analysis
18,Narcissists and Hypothetical Antisocial Proposals #shorts
19,Stepson Killer Invokes Dissociative Identity Disorder as Defense | Letecia Stauch Case Analysis
20,Lori Vallow Convicted #shorts
21,Politician Leads the Fight Against Honesty | George Santos Behavior and Indictment Analysis
22,One Question Narcissists Never Ask Themselves  #shorts
23,Mother Writes Book to Help Sons Grieve Father She Allegedly Murdered | Kouri Richins Case Analysis
24,Sign of a Celebrity Grandiose Narcissist #shorts
25,Elizabeth Holmes Reinvents Herself as a Victim Who Will Change the World | Analysis of NYT Interview
26,Anhedonia with Grandiose and Vulnerable Narcissism #shorts
27,Prison Guard Accused of Killing Wife After New Year's Eve Party | Tom & Ashley Fallis Case Analysis
28,Example of What Happens When a Narcissist is a Victim #shorts
29,Hammer Homicide Has Striking Similarities to Jodi Arias Case | Marissa Devault Case Analysis
30,Do Romantic Partners Tend to Have Similar Personality Traits? #shorts
31,College Student Who Killed Two Pedestrians Cannot Stop Smiling | Stephanie Melgoza Case Analysis
32,Was Michael Jackson Impersonator Murdered on New York Subway? | Jordan Neely Case Analysis
33,Mental Disorders and Romantic Relationship Dealbreakers #shorts
34,Borderline Personality Disorder and the Eternal Quest for Romantic Satisfaction #shorts
35,Two Armed Men Square Off on a Rural Access Road | Joe Campbell Case Analysis
36,Using the Narcissistic Grudge to Achieve Therapeutic Goals #shorts
37,Men Kill Innocent Motorist with Rock | Alexa Bartell Case Analysis
38,Rumination and Anger with Vulnerable Narcissism #shorts
39,Mother Falsely Accuses Hispanic Couple of Attempted Kidnapping | Katie Sorensen Case Analysis
40,Killer Clown Plots to Steal Victim's Criminal Husband | Marlene Warren and Sheila Keen-Warren
41,Which Defense Mechanisms are Associated with Borderline Personality Disorder? #shorts
42,Analysis of Markle Family Interview | Is Meghan Markle Justified in Cutting Off Her Family?
43,The Persistent Anger of Narcissism in Counseling #shorts
44,Host of Crass Talk Show Leaves a Contentious and Divisive Legacy | Jerry Springer Case Analysis
45,Example of Reaction Formation Defense Mechanism #shorts
46,Real-Life Superhero Phoenix Jones Is Arrested For Dealing Drugs | Ben Fodor Case Analysis
47,How to Tell if a Narcissist is Faking Affective Empathy #shorts
48,Steven Crowder Surveillance Video Controversy Analysis | Dangers of Immaturity
49,"Kamala Harris ""Moment in Time"" Word Salad #shorts"
50,Unpopular Anchor Finally Pushes CNN Too Far | Don Lemon Case Analysis
51,Emotional Hypochondriasis and Borderline Personality Disorder Treatment #shorts
52,Supermarket Worker Kidnaps High School Student from Bus Stop | Sierra LaMar Case Analysis
53,Why Are Narcissists Reluctant to Admit Mistakes #shorts
54,Analysis of Tucker Carlson Controversy | Why Was Tucker Fired?
55,Narcissism and the Defense Mechanism of Humor #shorts
56,Did Deputy Kill Unarmed Man to Protect Her Ego? | Christopher Lee Mercurio and Lorena Gonzalez
57,Example of Narcissistic Deception Related to Self-Esteem #shorts
58,Bud Light / Dylan Mulvaney Controversy Update | Is Boycott a Transgender Debate Inflection Point?
59,Lack of Empathy as A Missing Safety Feature for a Narcissist #shorts
60,Wife Shoots Husband Who She Claims was a Bear | Mark and Mary Beth Harshbarger Case Analysis
61,Tactics for Treating a Vulnerable Narcissist #shorts
62,Transgender Teacher Helps Students to Bust Out Laughing | Kayla Lemieux Case Analysis
63,"The ""Remorse for the Superior Self"" Problem of Treating Narcissism #shorts"
64,Woman Seeking Reparations from Target Store Finds Employee's Fist | Ohio Target Reparations Incident
65,"Charges Dismissed Against Alec Baldwin / ""Rust"" Continues Production #shorts"
66,Son Commits Unthinkable Crime Against His Mother Who Tried to Help Him | Ari Liggett Case Analysis
67,Evaluating Anxiety for a Connection to Obsessive-Compulsive Disorder #shorts
68,"Teenager at Wrong House was Shot Twice by ""Fearful"" Resident  | Ralph Yarl Case Analysis"
69,Fascinating Poll on Transgender Controversy / Anheuser-Busch Boycott #shorts
70,Did Phantom Intruder Force Husband to Shoot His Wife? | Nicholas Firkus Case Analysis
71,What is Trauma-Coerced Attachment (Trauma Bonding) #shorts
72,Crime Lab Analyst Accused of Dexter Morgan Impersonation | Claire Hough & Kevin Brown Case Analysis
73,What is a Nervous Breakdown? #shorts
74,"Man Buys ""Wite Out"" to Cover Blood After Killing ""Excess Lover"" | Jessica O'Grady Case Analysis"
75,Are Women Attracted to Men with Psychopathic Traits? #shorts
76,Six-Year-Old Shooter Case Update | Analysis of Abigail Zwerner Lawsuit
77,Example of Effects of Narcissistic Parents #shorts
78,Far Right Airman Uses Top-Secret Clearance to Impress Teenagers | Jack Teixeira Case Analysis
79,Infant Mysteriously Disappears from Crib as Intoxicated Mother Passed Out | Lisa Irwin Case Analysis
80,Example of Gaslighting Effect from Vulnerable Narcissist Husband #shorts
81,Analysis of Transgender Rights Debate | Dylan Mulvaney and Bud Light Controversy
82,Lori Vallow Wants to Leave the Courtroom #shorts
83,Did Uber Driver Who Killed BLM Protester Act in Self-Defense? | Daniel Perry Case Analysis
84,Mother of Six-Year-Old Shooter Has Been Indicted #shorts
85,Depressed Ranger Disappears in the Wilderness | Randy Morgenson Case Analysis
86,Does Overvaluation Behavior in Parents Lead to Narcissistic Children? #shorts
87,10-Year-Old Son Shoots National Socialist Party Leader Father | Joseph Hall Case Analysis
88,Altruistic Lies and Personality Traits #shorts
89,Analysis of Donald Trump Charges | Political Prosecution or Necessary Tactic to Deprecate Bully?
90,Narcissism and Manipulating Through the Last Will and Testament #shorts
91,Teenagers Are Kidnapped as Home Burns | Lauria Bible and Ashley Freeman Case Analysis
92,Happy Easter 2023 #shorts
93,Prankster Shot by Practical Joke Target in Mall Food Court | Tanner Cook Case Analysis
94,Man Found Wrapped in Carpet After Going Wild on Business Trip | Nathan Millard Case Analysis
95,A Dilemma of Adult Survivors of Narcissistic Parents #shorts
96,Juvenile Detention Romance Blossoms into Stabbing | Tawnee Baird and Victoria Mendoza Case Analysis
97,Donald Trump Pleads Not Guilty to 34 Felony Counts of Falsifying Business Records #shorts
98,Husband Cannot Explain Cheating Wife's Suspicious Death | Jason and Tiffiney Crawford Case Analysis
99,QAnon Supporter Personality Traits and Political Allegiance #shorts
100,Grandmother Involved in Hot Vehicle Death and Drowning 11 Months Apart | Tracey Nix Case Analysis
101,Five-Factor Profile for Borderline Personality Disorder #shorts
102,Real Killer Identified After False Conviction | Christine Jessop Case Analysis
103,Bizarre Quasi-Confession Leads to Unsupported Murder Charges | Andrea Cincotta Case Analysis
104,Is It Possible to Change Personality Traits? #shorts
105,Nonsense-Peddling Lifestyle Guru Defeats Starstruck Collision Causer | Gwyneth Paltrow Case Analysis
106,Five-Factor Profile for Histrionic Personality Disorder #shorts
107,Stalker Mounts Borderline Personality Pathology Defense | Molly McLaren Case Analysis
108,Donald Trump Indictment and Alvin Bragg's No-Win Scenario #shorts
109,Family Annihilation or Leg Cramp? | Lawrence DeLisle Case Analysis
110,Five-Factor Profile for Paranoid Personality Disorder
111,Transgender Ideology and Christianity in the Nashville School Shooting | Audrey Hale Case Analysis
112,Young Woman Disappears After Rejecting Advances by Creepy Roommate | Maribel Ramos Case Analysis
113,Predictors of Early Onset Borderline Personality Disorder #shorts
114,Wife Kills Two Husbands in Same Bedroom 28 Year Apart | Colleen Harris Case Analysis
115,Narcissistic Baiting Within a Mother / Daughter-in-Law Relationship #shorts
116,Homicidal Professor Exploits His Victim's Infidelity Euphoria | Tom Murray Case Analysis
117,Abigail Zwerner Recalls Being Shot by Six-Year-Old First Grade Student #shorts
118,"Stanford Law ""Dean of Diversity, Equity, and Inclusion"" Supports Immature Protest Against Judge"
119,Lori Vallow Update #shorts
120,Dentist Repeatedly Orders Poisons Before Wife's Death | James Craig Case Analysis
121,Writer Murdered by Convicted Killer She Was Rehabilitating | Brett Morgan & Louise Ellis Analysis
122,Self-Serving Lies and Personality Traits #shorts
123,Strange Series of Phone Calls Precede Missing Person Mystery | Brandon Lawson Case Analysis
124,Three Types of Deception #shorts
125,FBI Agent's Wife is Unconcerned After Body Found Next to Their House | Scott Horn Case Analysis
126,Is Borderline Personality Disorder a Variant of PTSD? #shorts
127,Donald Trump Indicted Over Hush Money Payment? | Stormy Daniels/Trumped-Up Charges Case Analysis
128,Train Family Wieambilla Murders Analysis | Christian Fundamentalists or Delusional?
129,"3 Signs of the ""Eternal Victim"" in Mother / Daughter-in-Law Relationship  #shorts"
130,Cosplay Actress Lightly Stabbed Boyfriend During Argument | Melissa Turner Case Analysis
131,Happy Saint Patrick's Day #shorts
132,Police Officer with Narcissistic Personality Wreaks Havoc in Court | Richard Wills Case Analysis
133,Complex Intruder Murder of Socialite Ends in Surprise Verdict | Doris Angleton Case Analysis
134,Obsessive-Compulsive Disorder and Personality Disorder Comorbidity #shorts
135,Black Widow Fails to Murder Lover with Point Blank Rifle Shot | Patricia Byers Case Analysis
136,"The ""Watching Eyes"" Effect and Antisocial Behavior #shorts"
137,Hugh Grant Exposes Vanity Fair of Oscars with Metaphorical Slap | 2023 Oscars Interview Analysis
138,Personality Traits and Ethical Leadership #shorts
139,Podcaster Unable to Escape Covert Friendship with Stalker | Zohreh Sadeghi Case Analysis
140,Do Men and Women Score Differently on the Five Factor Model of Personality? #shorts
141,Hiker Kills Mountain Climber with Single Rock Throw | Pete Absolon Case Analysis
142,Panic and Bank Run at Silicon Valley Bank #shorts
143,Missing Teenager's Car Found on Interstate | Logan Schiendelman Case Analysis
144,Robert Blake Update #shorts
145,Mother and Son Stage Scene to Embarrass Cheating Wife | Lisa Carlson Case Analysis
146,Paul Flores Sentenced for the Murder of Kristin Smart #shorts
147,Were Police Justified in Killing Sovereign Citizen During Traffic Stop? | Chase Allen Case Analysis
148,Woman Disappears from Her House During Wild Dating Phase | Nancy Moyer Case Analysis
149,Personality Traits and Psychotherapy Outcomes #shorts
150,Great Actor Both Embraced and Despised Substances | Tom Sizemore Case Analysis
151,Bryan Kohberger DNA Fears? #shorts
152,Police Officer Makes the Most of Her Biology Degree | Maegan Hall Case Analysis
153,Do Any Preschool Traits Predict Violent Crime in Adulthood? #shorts
154,Welder Uses Cutting Torch to Perpetrate Unthinkable Crime | Jonathan Foster Case Analysis
155,Narcissistic Personality Disorder and Comorbidity #shorts
156,Missing Walmart Shopper Attracts No Empathy from the Police | Tiffany Whitton Case Analysis
157,Was There Enough Evidence to Convict Alex Murdaugh? | Analysis of Murdaugh Double Murder Trial
158,Racy Black Widow Murdered Lovers in Plain Sight | Blanche Taylor Moore Case Analysis
159,Manipulation Powers of Alex Murdaugh #shorts
160,Did Mother Frame Her Daughter for Homicide? | Debbie Collier Case Analysis
161,Alex Murdaugh Verdict #shorts
162,Did Missing 13-Year-Old Have a Secret Life? | Tabitha Tuders Case Analysis
163,Was Bryan Kohberger an Unfriendly Fishing Shop Worker? #shorts
164,Does Complex Conspiracy Explain Intoxicated Fall from Cruise Ship? | George Smith IV Case Analysis
165,Personality Traits and Death #shorts
166,Missing Man's Car Is Found Stuck on a Mountain | Matthew Weaver Jr. Case Analysis
167,How to Get Something from a Narcissist #shorts
168,Story Behind The Cocaine Bear | Dangers of Excitement-Seeking James Bond Paramilitary Drug Smugglers
169,Which Personality Disorder Interferes the Most with Counseling? #shorts
170,Aspiring Missing Person Identifies as Madeleine McCann | Julia Faustyna (Wendell) Case Analysis
171,Cycle of Narcissistic Rage #shorts
172,Attorney's Ex-Wife Goes Overboard on Cheap Cruise | Lonnie Kocontes Case Analysis
173,Differences Between Antisocial Killers With and Without Psychopathy #shorts
174,Wife's Infidelity Leads to Three Suspects in Her Murder | Stephanie Roller Bruner Case Analysis
175,Man Who Escaped Justice for 25 Years Writes Letter Explaining Motive | Lisa Ziegert Case Analysis
176,Doomsday Preppers Personality Characteristics #shorts
177,Prince Harry and Meghan Markle Receive Opportunity to Gain Insight from South Park Episode
178,What Are the Effects of Psychopathy on Romantic Relationships? #shorts
179,Missing Student Mystery Solved After 47 Years | Kyle Clinkscales Case Analysis
180,Nicola Bulley Update #shorts
181,Was Duke Lacrosse False Accuser Convicted of Murder as Payback? | Crystal Mangum Case Analysis
182,Lawyer Couple Plants Drugs on PTA President Who 'Offended' Them | Jill & Kent Easter Case Analysis
183,Microsoft AI Chatbot Controversy Analysis | Chatbot Reveals Destructive Desires to New York Times
184,Dark Triad Traits and Lie Detection Abilities #shorts
185,Did Dentist Kill Romantic Rival in Genius Plot? | Thomas Kolman Case Analysis
186,Dark Triad Traits and Infidelity #shorts
187,Murder Suspect Attacks Her Own Lawyer in Court | Taylor Schabusiness Case Analysis
188,What is Maladaptive Daydreaming? #shorts
189,Suspicion Falls on Prospector Who Returned Alone from Outback | Ray and Jennie Kehlet Case Analysis
190,Behaviors of Narcissistic Leaders #shorts
191,Overrated Influencer Disrespects Actors | What Happens Next Is Shocking | Dhar Mann Controversy
192,Happy Valentine's Day #shorts
193,"Killer Canine, Ghost River, or Quiet Kidnappers? | Nicola Bulley Case Analysis"
194,"Idaho Murders Update to ""Eight-Hour Delay"" Explanation #shorts"
195,Update to Six-Year-Old Shooter Case | Abigail Zwerner Case Analysis
196,What is the Most Difficult Challenge When Treating Narcissistic Personality Disorder? #shorts
197,Two Gunshots in Closet Lead to One Massive Mystery | Jessica Boynton Case Analysis
198,Which Factor of Impulsivity is the Worst? | Four-Factor (UPPS) Model of Impulsivity #shorts
199,Did Chauffeur Throw Girlfriend Off Cliff Like a Spear? | Caroline Byrne Case Analysis
200,Unsettling Reason Bryan Kohberger Was Fired as Teaching Assistant #shorts
201,Does Postpartum Psychosis Explain Horrific Family Killing? | Lindsay Clancy Case Analysis
202,Lindsay Clancy and Postpartum Psychosis as a Defense #shorts
203,Teenage Lovers Murder Intoxicated Man | Amy Lee Black Case Analysis
204,Which Personality Characteristics are Important to Women Selecting a Male Partner? #shorts
205,"Zombie Fan Defends Herself Against ""Dirty"" John Meehan | John Meehan Case Analysis"
206,Killer Bathtub or Husband Who Clumsily Staged Crime Scene? | Shele and Roderick Covlin Case Analysis
207,"Tristyn Bailey Case Update | ""Bad Boy"" Image Sometimes Fits #shorts"
208,Son Hides Motive for Sledgehammer Murder Behind Bizarre Presentation | Zachary Davis Case Analysis
209,Prince Harry and Meghan Markle Popularity Drops Drastically #shorts
210,"Is Pamela Anderson Trapped in the Past? | Analysis of Netflix Documentary ""Pamela: A Love Story"""
211,Imposter-Free Duplicates? | Reduplicative Paramnesia | Delusion of Misidentification #shorts
212,Did Instagram Model Defend Herself with Impossible Knife Throw? | Courtney Clenney Case Analysis
213,Does Texting Make Teenagers More Shallow? #shorts
214,Garage Sale Homicide with No Apparent Motive | Elizabeth Barraza Case Analysis
215,Is Vulnerable Narcissism Contagious? #shorts
216,Woman Murders Stepfather After Finding Images of Herself on His Computer | Jade Janks Case Analysis
217,How the Rejection Mindset Destroys Online Dating Success #shorts
218,Judge Kills Two Prosecutors Who Pursued Him for Minor Offenses | Eric Williams Case Analysis
219,Example of the Difference Between Empathy Deficit and Sadism Tip 1 #shorts
220,"""Birdwatcher"" with Telescope Sees Woman Kidnapped from Beach | Heather Teague Case Analysis"
221,Malignant Narcissism and Antisocial Personality Disorder #shorts
222,Teenager Exhibits Strange Behavior Before Disappearing | Mekayla Bali Case Analysis
223,What Causes Narcissistic Eruptions? #shorts
224,"""Romance Author"" Who Faked Death has a Resurrection | Susan Meachen Case Analysis"
225,Does Text Used on Twitter Predict Personality? #shorts
226,Doomed Police Gang Unit Beats Motorist to Death During Traffic Stop | Tyre Nichols Case Analysis
227,Paul Pelosi Hammer Attack Body Camera Video Raises Questions #shorts
228,Conservative Commentator Exposes Daily Wire's Plot to Overpay Him | Steven Crowder Case Analysis
229,"What is a ""Becky"" in the Incel Subculture? #shorts"
230,"Inspiration for Inutile ""Amber Alert"" System | Amber Hagerman Case Analysis"
231,Six-Year-Old Shooter Case Update #shorts
232,Early Release After Four First-Degree Murders? | Janet Danahey Case Analysis
233,"What is a ""Chad"" in the Incel Subculture? #shorts"
234,Did Nurse Fabricate Stories of World's Most Prolific Stalker? | Cindy James Case Analysis
235,Borderline Personality Disorder vs. Dependent Personality Disorder #shorts
236,Teacher Dies After Being Tased Six Times in 42 Seconds | Keenan Anderson Case Analysis
237,"What is a ""Stacy"" in the Incel Subculture? #shorts"
238,Six-Year-Old First-Grader Intentionally Shoots Teacher | Richneck Elementary School Shooting
239,The Connection Between Schizoid Personality Disorder and Serial Killers #shorts
240,Killer Fabricates Home Invasion Story Too Complex for Him to Remember | Richard Dabate Case Analysis
241,How Can Ugly Men Appear Attractive to Women? #shorts
242,"Did Alec Baldwin Commit Involuntary Manslaughter? | ""Rust"" Shooting Update and Analysis"
243,Vindictiveness of the Vulnerable Narcissist #shorts
244,"Does ""All Gas, No Brakes"" Host Refuse to Take ""No"" for an Answer? | Andrew Callaghan Case Analysis"
245,Involuntary Manslaughter Charges for Alec Baldwin #shorts
246,Con Artist Allegedly Kills Wife While on House Arrest | Brian & Ana Walshe Case Analysis
247,Was Bryan Kohberger's Instagram Rejection a Motive? #shorts
248,What is Criminal Personality Disorder? #shorts
249,College Athlete Avoids Severe Consequences for Bare-Handed Murder | Yeardley Love Case Analysis
250,Personality of Serial Killer vs. Single Homicide Offender #shorts
251,Yale PhD Student Murdered 5 Days Before Wedding | Annie Le and Raymond Clark Analysis
252,Behaviors Associated with Creepiness #shorts
253,College Student Mysteriously Dies at Alcohol-Fueled Wakeboarding Event | Lauren Agee Case Analysis
254,Why Do People with Borderline Select Romantic Partners with Personality Disorders?  #shorts
255,"Daughter of ""King of Rock and Roll"" Could Not Escape His Legacy | Lisa Marie Presley Case Analysis"
256,Five Central Beliefs of the Incel Subculture #shorts
257,Was Podiatrist Wrongly Convicted of Murder? | Dr. Adam Frasch Case Analysis
258,Bryan Kohberger (Idaho Murders Suspect) Romantically Rejected in School #shorts
259,Husband Recites Bizarre Story to Explain Wife's Disappearance | Ciera Breland Case Analysis
260,What Women Believe About Creepy Men #shorts
261,"""Real Housewives"" Star Defrauds Elderly Victims Out of Millions of Dollars | Jen Shah Case Analysis"
262,Personality and Academic Performance #shorts
263,Mysterious Disappearance During Notorious Alaska Race | Michael LeMaitre Case Analysis
264,Contradictory Perceptions of Bryan Kohberger by his Neighbors #shorts
265,"Prince Harry ""60 Minutes"" Interview Analysis | Has Harry Transformed Into His Worst Fear?"
266,"Journey of Exploration Aspect of Prince Harry ""60 Minutes"" Interview #shorts"
267,Wife Texts Lover While On Date Night With Husband | Kira Steger Case Analysis
268,"""When Prince William Attacks"" Aspect of Prince Harry ""60 Minutes"" Interview #shorts"
269,What Does Tonic Immobility Feel Like? (Freeze Response) #shorts
270,Why is Licensing Board Threatening Jordan Peterson's License? | Dangers of Emotional Board Members
271,Vulnerable Narcissistic Injury #shorts
272,Is Bryan Kohberger Guilty? | Analysis of Probable Cause Affidavit in Idaho Quadruple Murder Case
273,"Intermittent Explosive Disorder, Alexithymia, and Anger Rumination #shorts"
274,"Woman Manipulates Man in ""Sex-Free Marriage"" Before Murdering Him | Rebecca Cleland Case Analysis"
275,Bryan Kohberger and Army Ranger Aspirations #shorts
276,Casual Girlfriend of Samuel Bankman-Fried Rapidly Turns on Him | Caroline Ellison Case Analysis
277,Bryan Kohberger and His Decision to use a Public Defender #shorts
278,Ultimate Alpha Male Teaches Followers About Downside of Nonsense | Andrew Tate Update and Analysis
279,Impossible Situation of Bryan Kohberger's Family #shorts
280,Adopted Son Commits Unthinkable Betrayal | Natalie Belmonte Case Analysis
281,Former Professor's Description of Bryan Kohberger #shorts
282,College Student Disappears After Mysterious Single-Vehicle Collision | Jason Landry Case Analysis
283,Murder-Free in 23? | Happy New Year 2023 #shorts
284,Why do People with Kleptomania Steal? #shorts
285,Did PhD Student Plan the Perfect Murder to Gain Infamy? | Bryan Christopher Kohberger Case Analysis
286,"Bryan Kohberger, Narcissism, and Planning the Perfect Murder #shorts"
287,Family Killer Offers Absurd Defense During Testimony at His Trial | Update to Anthony Todt Case
288,Idaho Murder Suspect Bryan Kohberger and the Multiple Killer Mystery #shorts
289,Bryan Christopher Kohberger Arrested in Idaho Quadruple Murder Case #shorts
290,Series of Lies Prove that Congressman-Elect is a Real Politician | George Santos Case Analysis
291,One Insight Needed for Narcissists to Break Free of Symptoms #shorts
292,Wife Mismanages Potentially Valid Self-Defense Claim | Jema Donahue Case Analysis
293,Neuroticism's Strange Relationship to Aggression #shorts
294,TikTok Psychic Uses Idaho Murders to Falsely Accuse Professor | Ashley Guillard Case Analysis
295,Childhood Factors that Predict Antisocial Personality Disorder #shorts
296,"Soldier Shoots Wife ""Accidentally"" and Escapes Serious Consequences | Skylar and Danielle Nemetz"
297,Borderline Personality Disorder and Crying #shorts
298,Physician Wanted for $70M Fraud Disappears After Boat Collision | Dr. Marvin Moy Case Analysis
299,Does Santa Claus Have a Personality Disorder? | St. Nick Mental Health and Personality
300,Christmas Trees in My House #shorts
301,Minnesota Mystery | LeeAnna Warner Case Analysis
302,What Contributes to Subclinical Paranoia? #shorts
303,Was Homicide of Sleeping Husband Self-Defense? | Helen Naslund Case Analysis
304,Christmas Time and Mental Health (Why Low Expectations Can Be Good) #shorts
305,Police Officer Claims Self-Defense After Shooting Woman in House | Aaron Dean Case Analysis
306,Narcissism and Conspiracy Theories #shorts
307,Child Actress Goes From Fame to Prison | Lora Lee Michel Case Analysis
308,Personality Traits of an Effective Liar #shorts
309,Billionaire and Wife are Mysteriously Killed in Mansion | Barry & Honey Sherman Case Analysis
310,Machiavellian without Psychopathy and Narcissism? #shorts
311,Phenomenally Charming Man Recklessly Kills Lover | Kelly Dwyer & Kris Zocco Case Analysis
312,Sign of a Narcissistic Mother / Normal Daughter #shorts
313,Dermatologist Kills Wife After Her Concerns About Cross-Dressing | Dr. Richard Sharpe Case Analysis
314,Hoarding Disorder and Attachment Theory #shorts
315,"Analysis of ""Harry & Meghan"" Netflix Documentary Episodes 4 - 6 | Dangers of a Monarchy Messiah"
316,Posting Selfies and Histrionic Personality #shorts
317,Nurse with Factitious Disorder Murders Four Patients | Beverley Allitt Case Analysis
318,Self-Proclaimed Psychotherapist Manipulates Client to Confess | Robert Lowe Case Analysis
319,Paradox of Unrequited Love Counseling Strategy #shorts
320,Did Parents Have Secret Daughter Impersonate Murder Victim? | Mary Day Case Analysis
321,Island Sex Fantasy of the Narcissist #shorts
322,Was Suspicious Disappearance an Attempt to Start a New Life? | Robert Hoagland Case Analysis
323,Severe Social Anxiety with Panic Attacks Combined with Perfectionism #shorts
324,Men Follow New Age Guru on Dangerous Sea Voyage | Isaac Danian and Shukree Abdul-Rashed
325,Sign of the Super Narcissist #shorts
326,Narsissitic Admiration vs. Narcissistic Rivalry #shorts
327,Chief of Police Uses Position to Avoid Ticket | Mary O'Connor Case Analysis
