,Title
634,Unable to Differentiate a Relationship from a Dinner Menu? | Katherine Knight Case Analysis
635,British Television Personality Creates the Worst Disguise | Jimmy Savile Case Analysis
636,Is Nurse Who Caused Excruciating Death of a Patient a Victim? | RaDonda Vaught Case Analysis
637,Parachute Sabotage Attempted Murder | Emile and Victoria Cilliers Case Analysis
638,Starting a New Life After Faking Death in Canoe | John Darwin Case Analysis
639,Mother and Daughter Murder Team | Joan and Elizabeth Shannon Case Analysis
640,Boarding House Serial Killer | Dorothea Puente Case Analysis
641,"Dissociative Fugue, Bipolar, or Tired of Husband? | Judy Smith Case Analysis"
642,"Did Body Language Analysis ""Experts"" Crack the Will Smith Attack?"
643,Was the Bad Vegan a Victim or a Perpetrator? | Sarma Melngailis and Anthony Strangis Case Analysis
644,The Cost of Child Actor Fame | Dana Plato Case Analysis
645,False Confession for Love? | Jens Soering and Elizabeth Haysom
646,Will Smith Slap Update | Chris Rock's Reaction | Should Will Smith be Expelled from the Academy?
647,From Conspiracy Cult to Prison | Tony Alamo Case Analysis
648,Chorus of Shame Leads to Disaster | Zack Bowen and Addie Hall
649,When Will Smith Attacks | Will Smith and Chris Rock Academy Awards Slap
650,Lethal Borderline Traits | Kimberly Cargill Case Analysis
651,Secret Assassin? | Todd and Carole Garton Case Analysis
652,Zelenskyy's Fight for Freedom | Volodymyr Zelenskyy Case Analysis
653,Consciousness of Guilt in Fatal Push Attack? | Lauren Pazienza Case Analysis
654,Sent to the Farm or Murdered? | Skelton Brothers and John Skelton Case Analysis
655,Warden's Wife Helps Killer Escape Prison | Bobbi Parker and Randolph Dial
656,TikTok Cult? | 7M Films and Miranda Derrick Case Analysis
657,Fake Cancer Fraud | Coco Berthmann Case Analysis | What is Pathological Lying?
658,Roof Demon Killers? | Jamison Family Deaths Case Analysis
659,"""Real"" Guru | Sadhguru (Jaggi Vasudev) Case Analysis"
660,Police Officer Plans the Perfect Murder | Kenneth Bluew Case Analysis
661,Rural Road Attack or Conspiracy? | Peter Falconio Case Analysis
662,Will Jail Help a Victim Narcissist? | Jussie Smollett Sentencing
663,Wife Leaves Letter Implicating Husband in Her Murder | Sandra Duyst Case Analysis
664,Son Murders Mother because she had Bipolar Disorder? | Jeffrey Pyne Case Analysis
665,FBI Special Killer Agent | Mark Putnam / Susan Daniels Smith Case Analysis
666,Predisposition to Falsely Confess Leads to Death Row? | Melissa Lucio Case Analysis
667,Love of a Mountain vs. Love of a Father | Alex Lowe Case Analysis
668,Gun Struggle Mansion Murder | Bob and Diane Ward Case Analysis
669,Legal Home Invasion? | Breonna Taylor Case Analysis
670,Did Father/Son Dynamic Lead to Millionaire's Murder? | Richard Oland Case Analysis
671,"Was Serial Squatter the ""Worst Roommate Ever?"" | Jamison Bachman Case Analysis"
672,Sherri Papini Update | What was the Motive for Sherri's Hoax?
673,Disgruntled College Student Turned Sniper | Shane Ragland Case Analysis
674,"""Music Video"" Harassment | Kanye West, Kim Kardashian, and Pete Davidson Controversy |"
675,Taylor Swift Delusion and Waffle House Shooting | Travis Reinking Case Analysis
676,Stolen Identity Homicide | Albert Walker Case Analysis
677,Lethal Movie Theater Popcorn? | Curtis Reeves Case Analysis
678,"""Do You Know Who I Am?"" Traffic Stop Incident | Martin Hyde Case Analysis"
679,Bernie Tiede and Marjorie Nugent Case Analysis
680,Manhattan Medium | Talking to the Dead or Searching Facebook? | Thomas John Case Analysis
681,Cryptocurrency Con Artist Death Leads to Missing Passwords | Gerald Cotten Case Analysis
682,Sunday School Teacher Turned Killer | Sandra Cantu Case Analysis
683,Does Putin Have Dark Triad Traits? | Vladimir Putin Case Analysis
684,Mensa Murderer | George Trepal Case Analysis | High IQ Society or High Narcissism Society?
685,Doris Duke Case Analysis | Did Doris Duke Deliberately Run Over Eduardo Tirella?
686,Bizarre Accident or Conspiracy? | Kendrick Johnson Case Analysis
687,Dentist Attempts to Complete Perfect Murders | Dr. Colin Howell Case Analysis
688,Demon Reveals Identity of Witches | Greg Locke Case Analysis
689,Father of TikTok Star Kills Intruder | Ava Majury Case Analysis
690,A Fraudulent Account of Fraud? | Frank Abagnale Jr. Case Analysis
691,BDSM Desire of Death | Ben Novack Jr. Case Analysis
692,Courteous Killer or Staged Disappearance? | Michael Chambers Case Analysis
693,15-Year Old Killer | Alyssa Bustamante Case Analysis
694,Gambling Grandmother Turns to Murder | Lois Riess Case Analysis
695,Joe Rogan Controversy Analysis | Free Speech vs. Misinformation
696,Homicide by Longtime Friends | Sarah Stern Case Analysis
697,$4.5 Billion Bitcoin Laundering Scheme | Ilya “Dutch” Lichtenstein and Heather Morgan Case Analysis
698,Murdered on a Deserted Island | Sea Wind Case Analysis
699,Paving Brick Self-Defense? | Tom and Molly Martens Case Analysis
700,4-Month-Old Abducted from House During the Night | Sabrina Aisenberg Case Analysis
701,Whoopi Goldberg Controversy | Dangers of Pairing False Statements with Opinion
702,"""Sex Pistols"" Punk Rocker Guilty of Murder? | Sid Vicious and Nancy Spungen Case Analysis"
703,"""The Tinder Swindler"" | Simon Leviev Case Analysis"
704,Honeymoon Murder in South Africa | Anni Dewani Case Analysis
705,Big Game Hunter Love Triangle | Lawrence Rudolph Case Analysis
706,Wannabe Surgeon Becomes Wannabe Killer | Leon Jacob Case Analysis
707,"""OKBaby"" Breakup Analysis | Dangers of Combining Romance, Children, and Business"
708,Manic Disappearance and Failure to Treat | Asha Kreimer Case Analysis | Repeat of Elisa Lam Case?
709,Defamation to Save the World from Indecency? | Cardi B and Tash K Defamation Lawsuit
710,Reincarnated Fighter Pilot or Fantasy? | James Leininger Case Analysis
711,Immature Trooper Fails to Own Behavior | Ryan Wingo and Charles Donner Case Analysis
712,Precision Drill Team Kidnapping | Nancy Motes Case Analysis
713,Killer British Nanny | Is Shaken Baby Syndrome Pseudoscience? | Louise Woodward Case Analysis
714,Thank You for One Million Subscribers! | Five Things I Have Learned in 50 Years
715,The Shame of Deception | Chandler Halderson Case Analysis
716,Secret Agent Con Artist | Robert Hendy-Freegard Case Analysis
717,Wrongful Acquittal and Double Jeopardy | Melvin Ignatow Case Analysis
718,Analysis of Feud Between Jamie Lynn Spears and Britney Spears
719,Double Homicide and 15-Year Fraud | Christopher and Susan Edwards Case Analysis
720,Faking Death to Cheating Death | Nicholas Alahverdian Case Analysis
721,Playmate Homicide | Dorothy Stratten Case Analysis
722,Seditious Conspiracy | Analysis of Stewart Rhodes and Oath Keepers
723,Treva Throneberry Case Analysis | Dangers of Being Forever Young
724,Prince Andrew Loses Titles | Duke of York Case Analysis
725,"Parents Support Son Who Murdered Daughter | ""Life with Murder"" (Mason Jenkins) Case Analysis"
726,Busybody Suspect | Jonelle Matthews Case Analysis
727,Port Arthur Massacre | Martin Bryant Case Analysis
728,Unlikely Snowstorm Rescue Saves Alleged Killer | Alan Lee Phillips Case Analysis
729,Hoax Inspired by Madeleine McCann Case | Shannon Matthews Case Analysis
730,Boat Push Homicide | Jerry Michael Williams Case Analysis | Dangers of the Tell-Tale Heart
731,Selling Flatulence in Jars | Stephanie Matto Case Analysis | What is Eproctophilia?
732,Igor and Grichka Bogdanoff Case Analysis | Dangers of a Lack of Insight
733,Fugitive Lives in Plain Sight for 52 Years | Theodore Conrad (Thomas Randele) Case Analysis
734,Amber Tuccaro Case Analysis | Hitchhiker Records Her Killer
735,Antonio Brown Case Analysis | Dangers of Dramatic Exits
736,Counselor Researches Dhar Mann's Videos | He Instantly Regrets It
737,Anu Singh Case Analysis | Dangers of Borderline Relationships
738,"Homeless Man ""Go Fund Me"" Fraud | Conspiracy of John Bobbitt, Mark D'Amico, & Kate McClure"
739,John F. Kennedy Jr. Case Analysis | Why Did JFK Jr. Crash His Aircraft? | Dangers of Quasi-Royalty
740,"Plane Crash Hoax, Worst Pilot Ever, or Both? | Analysis of Trevor Jacob Video"
741,"""Delta Karen"" Case Analysis | Who is Patricia Cornwall?"
742,Sleepwalking Murder or Unrequited Love? | Randy Herman Case Analysis
743,Flamethrower Santa Claus | Bruce Pardo Case Analysis
744,Girl Scout Murders at Camp Scott | Was Gene Hart Guilty?
745,"""Who Wants to be a Millionaire"" Scandal | Charles Ingram Case Analysis"
746,Christmas Mystery | Sodder Family Disappearance Analysis
747,"""The Grinch"" Case Analysis"
748,Awareness Without Intent? Daunte Wright and Kim Potter Case Analysis
749,Chester Weger Case Analysis | The Murders at Starved Rock
750,"""Celebrity Therapist"" Nightmare | Eugene Landy & Brian Wilson Case Analysis"
751,Fred Phelps Case Analysis | Westboro Baptist Church
752,Heidi Planck Case Analysis | Disappearance Connected to Massive Fraud or Mental Health?
753,110 Year Sentence for Killer Truck Descent | Rogel Aguilera-Mederos Case Analysis
754,Helicopter Prison Escape | Ronald McIntosh and Samantha Lopez Case Analysis
755,Rattlesnake Murder Weapon | Glenn Summerford Case Analysis
756,Cops Kill Rancher Who Was Trying to Kill Bull | Jack Yantis Case Analysis
757,Appalachian Trail Embezzler | James Hammes Case Analysis
758,"Four Men, One Murder, No Convictions | Robert Wone Case Analysis"
759,Lost in the Snow | James Kim Case Analysis | Lethal Sense of Direction
760,Turpin Family Case Update | The Nature of Courage and Intellectual Curiosity
761,Fake Serial Killer Expert | Stéphane Bourgoin Case Analysis
762,"Lethal Game of ""Simon Says"" | Daniel Shaver Shooting Analysis | Police Shooting of Unarmed Man"
763,Jussie Smollet Case Analysis (Update) | Did Jussie Plan a Hoax? | Dangers of Victim Narcissists
764,Adopted Russian Girl Returned for Mental Health Issues | Sabrina Caldwell Case Analysis
765,Ivan Milat Case Analysis | The Backpacker Killer
766,"House of Gucci Murder Case | Dangers of Gaudy, Tacky, and Overpriced Products"
767,Mountain Lion Homicide? | Christopher Whiteley Case Analysis
768,Stockdale Family Murders | Did Obsessive-Compulsive Trait Lead to Murder?
769,Convicted Based on Middle Name? | Michael Bernie Politte Case Analysis
770,"""The Watcher"" of New Jersey | Hoax or Stalker Abundance of Spare Time?"
771,"Ethan, James, and Jennifer Crumbley Case Analysis | Failure to Report Leads to Manslaughter Charges"
772,"Inspiration for ""Duty to Rescue"" Laws | David Cash (Bad Samaritan) Case Analysis"
773,Identity Transfer Murder | Rachel Barber and Caroline Reed Robertson
774,"Alec Baldwin Interview Analysis | Is Baldwin Blame-Shifting, Irresponsible, or a Victim?"
775,WeWork and Adam Neumann | $47 Billion Valuation Driven by New Age Nonsense?
776,Bikini Model / Physics Professor Fraud | Paul Frampton Case Analysis
777,Lethal Tough Guy Competition | Chad Read & Kyle Carruth Case Analysis
778,Zanesville Zoo Disaster | Terry Thompson Case Analysis
779,Long Island Medium | Theresa Caputo Case Analysis
780,Kelly Gissendaner | Was Her Execution Warranted?
781,Homecoming Queen Scandal | Laura Carroll and Emily Grover
782,Mysterious Hiking Deaths | John Gerrish and Ellen Chung Case Analysis
783,Ahmaud Arbery Case Update | What Role did Racism Play in the Murder?
784,Waukesha Christmas Parade Attack | Why Was Darrell Brooks Out of Jail?
785,Wardrobe Malfunction Case Analysis | Did Janet Jackson and Justin Timberlake Conspire to Offend?
786,Phillip Island Murder | Beth Barnard Case Analysis
787,"Marty Markowitz Case Analysis | Inspiration for ""The Shrink Next Door"""
788,The Happy Face Killer Case Analysis (Keith Jesperson) | Falsely Confessing to Convict Another?
789,Is Alan Miller Actually Jesus of Nazareth? | Dangers of Lazy Cult Leaders
790,Kyle Rittenhouse Update | What is the Meaning of the Verdict?
791,Bicycle Trip of Death | Jay Austin & Lauren Geoghegan Case Analysis
792,North Pond Hermit | Christopher Knight Case Analysis
793,Ted Kennedy Chappaquiddick Island Incident Analysis | Did Kennedy Commit Manslaughter?
794,Baby Jessica and Robert O'Donnell | Dangers of Media Attention for Heroes
795,Kathy Rowe Case Analysis | Harassment Campaign of Home Buyers
796,Maya Millete Case Analysis | Murder-For-Hire Spell Casters?
797,"Psychic Fraud Case Study | Vera Pratt and ""Psychic Angela"""
798,Claudine Longet Case Analysis | Bathroom Firearm Lesson Gone Bad or Murder?
799,Kyle Rittenhouse Case Analysis | Self-Defense or Murder?
800,Aaron Rodgers' Anti-Vaccination Behavior and Deception Controversy Analysis
801,Martha Moxley Case Analysis | Did Kennedy Connection Lead to Overturned Guilty Verdict?
802,Brittany Murphy Case Analysis | Was Simon Monjack Responsible for Brittany's Death?
803,Travis Scott & Astroworld Festival Human Stampede | What Causes Human Stampedes?
804,Twilight Zone Movie Set Fatalities Case Analysis | Shared Guilt or No Guilt?
805,Todd Kendhammer | Case of the Killer Pipe?
806,Thank You for 900K Subscribers! | Who Are Dr. Grande's Favorite Comedians?
807,"""Australia's Madeleine McCann"" | Cleo Smith Case Analysis | What is Stereotypical Kidnapping?"
808,Brianna Maitland Disappearance Analysis | Car Found Crashed Into House
809,John and Ann Bender Case Analysis | Bipolar Disorder and Folie à deux?
810,Unhelpful Police and Mysterious Death | Mitrice Richardson Case Analysis
811,"Alec Baldwin ""Rust"" Movie Set Shooting Update | Could Those Involved Be Charged with Manslaughter?"
812,Military Cadet Killers | Diane Zamora Case Analysis
813,Joshua Maddux Case Analysis | How Did Maddux Get in a Chimney?
814,Murder After Tarasoff Warning | Robert Bierenbaum Case Analysis
815,Wrong House Halloween Disaster | Rodney Peairs / Yoshihiro Hattori Case Analysis
816,Rebecca Zahau Case Analysis | Two Mysterious Deaths in One Mansion
817,Lin Family Murders Analysis | Convicted by Anger Alone?
818,"Squid Game Analysis | Valuable Social Commentary, Aimless Drama, or Both?"
819,Beating First-Degree Murder Charge with Alien Lizards | Barbara Rogers Case Analysis
820,What is Havana Syndrome? | Directed Energy Weapons or Mass Psychogenic Illness
821,"Alec Baldwin ""Rust"" Shooting Analysis and Comparison to Brandon Lee Incident on ""The Crow"""
822,Jenelle Potter Case Analysis | Catfishing Murders with Fake CIA Agent
823,Death of Brian Laundrie | Gabby Petito Case Update | Narcissism Warning Signs
824,"Five Husbands, Two Murders | Betty Lou Beets Case Analysis"
825,Amy Lynn Bradley Disappearance Analysis | Complex Conspiracy or Simple Explanation?
826,Billy Milligan Case Analysis | Is Dissociative Identity Disorder Real?
827,Elisa Baker Case Analysis | Murder of Zahra Baker
828,Analysis of Harrison Family Murders | Asynchronous Family Homicide
829,Analysis of the Source Family and Jim Baker (Father Yod) | Dangers of Cult Leader Hang Gliding
830,"Is ""Forgetting Dad"" a Story of Dissociative Amnesia or Deception?"
831,Analysis of Keddie Murders | Quadruple Homicide in Rural California
832,Don Kemp Case Analysis | Aspiring Cult Leader Death
833,Tromp Family Adventure | Was Shared Psychotic Disorder Responsible?
834,Donald Lapre Case Analysis | Manipulating with Optimism
835,Samantha Wohlford Case Analysis | Impromptu Murder Conspiracy?
836,Did Dissociative Fugue Cause Three Disappearances? | Hannah Upp Case Analysis
837,Is Brian Laundrie Alive? | Gabby Petito / Brian Laundrie Case
838,"Norm Macdonald | Humor Style, Philosophy, and Personality"
839,Lorena and John Wayne Bobbitt Case Analysis | An Unfortunate Separation
840,Armed Robbery Without a Mask | Abigail Kemp (Diamond Diva) Case Analysis
841,"""Couch Guy"" TikTok Video Analysis | Gaslighting or Projection?"
842,Falsely Convicted by Dead Witness? | Kimberly Long Case Analysis
843,Can Partying be a Motive for Parricide? | Tyler Hadley Case Analysis
844,Jessica Heeringa Case Analysis | Brazen Abduction by Serial Killer
845,Wannabe Cop Arson Investigator Turned Arsonist | John Orr Case Analysis
846,Pastor and Killer | Kari Baker Case Analysis
847,"Brian Laundrie & ""Dog the Bounty Hunter"" Controversy | Has Duane Chapman Rehabilitated?"
848,Innocent of Murder on Yacht? Sue Neill-Fraser Case Analysis
849,Missy Bevers Case Analysis | Surprised Burglar or Planned Homicide?
850,Driven to Irrational Behavior by Pastor?  | Mary Winkler Case Analysis
851,Murder of Daughters to Punish Husband | Christy Sheats Case Analysis
852,Winning the Lottery to Murder | Abraham Shakespeare Case Analysis
853,"LuLaRoe: Tacky Leggings, Pyramid Scheme, or Both? | Is Multilevel Marketing a Legitimate Strategy?"
854,"Is Gabby Petito / Brian Laundrie case an example of “Missing White Woman Syndrome?"""
855,Crawford Family Murder Case Analysis | Carefully Staged Crime and Disappearance
856,Stacey Castor (Black Widow) Case Analysis | Homicide by Antifreeze Poisoning
857,Gabby Petito Case Update | Was Brian Laundrie Controlling?
858,Suzy Lamplugh Disappearance Analysis | Was Lamplugh Murdered by a Narcissist?
859,Richard Pusey Case Analysis | The Most Hated Man in Australia?
860,Analysis of Murdaugh Family Mystery | Collection of Suspicious Deaths
861,Jonathan Luna Case Analysis | Mysterious Death of an Assistant U.S. Attorney
862,Gabby Petito Case Analysis | Was Gabby Left Behind?
863,Jasmine Richardson & Jeremy Steinke Case Analysis | Rehabilitation After Three Homicides?
864,"Negligent Homicide on Cruise Ship | Salvatore ""Sam"" Anello Case Analysis"
865,Yuba County Five Case Analysis | Unexplained Disappearance and Deaths
866,Brenda Delgado (Kendra Hatcher Murder) | Insidious Love Triangle of Death
867,Jordan Cheyenne Controversy | Dangers of Thumbnail Image Posing
868,Margaret Rudin Case Analysis | Black Widow Motivated by Greed
869,Joe Rogan Ivermectin Controversy | Does Horse Dewormer Treat COVID-19?
870,"Duperrault Family Massacre | What Happened Aboard the ""Bluebelle?"""
871,Celeste Beard Johnson Case Analysis | Conspiracy to Murder Wealthy Husband
872,Social Media-Induced Mass Hysteria | Mysterious Tourette Syndrome Tics
873,Julius Jones Case Analysis | Innocent on Death Row?
874,Insane Clown Posse and Juggalos | Dangers of Hatchet-Wielding Clowns
875,Ray Gricar Disappearance Analysis | District Attorney Destroys Hard Drive Before Vanishing
876,Daybell's Children Weigh in on Guilt | Chad Daybell / Lori Vallow Update
877,Alicia Esteve Head (Tania Head) | Fake World Trade Center Survivor
878,McDonald's Scam Call Case Analysis | Obedience to Authority Meets Gullibility
879,After School Homicide | Colleen Ritzer / Philip Chism Case Analysis
880,Suitcase Killer | Melanie McGuire Case Analysis
881,Bryce Laspisa Disappearance Analysis | Abandoned Vehicle Mystery
882,Vampire Cult Murders | Rod Ferrell Case Analysis
883,Elizabeth Wettlaufer Case Analysis | Killer Nurse
884,"Bob Ross | Life, Death, and Personality"
885,Is Joe Biden a Failed President? | Biden Afghanistan Debacle
886,Dennis Nilsen Case Analysis | Britain's Jeffrey Dahmer
887,Mysterious Disappearance Followed by Inconsistent Stories | DeOrr Kunz Jr. Case Analysis
888,Mark Redwine Case Analysis | Shame Motivated Homicide
889,Fake Serial Killer | Thomas Quick (Sture Bergwall) Case Analysis
890,Dr. Jonathan Nyce Case Analysis | What is Passion / Provocation Manslaughter?
891,Miranda Barbour Case Analysis | Victim to Murderer
892,Misha Defonseca Case Analysis | Fake Holocaust Survivor
893,Summer Wells Case Analysis | Rural Home Mystery
894,"""Gone Girl"" Case | Denise Huskins and Aaron Quinn | Dangers of Incompetent Law Enforcement"
895,QAnon & Alien Lizard Homicides | Matthew Taylor Coleman Case Analysis
896,Fatal Fall from a Deck | Tamla Horsford Case Analysis
897,Tara Lambert Case Analysis | Aspiring Model to Failed Killer
898,Noura Jackson Case Analysis | Prosecutorial Misconduct in Matricide Trial
899,Dr. Juli Mazi | Magic Pellets to Prevent Covid-19 and Fake Immunization Cards?
900,Why Did an Entire Town Fail to Report a Murder? | Ken McElroy Case Analysis
901,Sneha Anne Philip Disappearance Analysis | 9/11 Victim?
902,Hospitalized for Nonexistent Delusion | Joshua Spriestersbach / Thomas Castleberry Case Analysis
903,Christian Martin Case Analysis | Corrupt Prosecution or Justice?
904,Betty and Barney Hill | Alien Abduction or Hoax
905,Frontier Airlines Duct Tape Incident Analysis | Maxwell Berry
906,Samantha Josephson Case Analysis | Mistaking a Killer for an Uber
907,Chris Chan (Christine Weston Chandler) Case Analysis | Merging with the Jail Dimension
908,Should Vaccination be Mandated? | COVID Vaccine Hesitancy
909,Jessica Wongso Case Analysis | Cyanide Killer | Was She Guilty?
910,Thank You for 800K Subscribers! | What Are Dr. Grande's Favorite Cars?
911,Bain Family Murders | Was David Bain Innocent?
912,Christopher Vaughn Case Analysis | Dissociative Amnesia or Malingering?
913,John DeLorean Case Analysis | Dark Side of Ambition
914,Anne Sacoolas (Death of Harry Dunn) | CIA Agent Wrong Way Driving vs Diplomatic Immunity
915,"Simone Biles Olympic Withdrawal | Mental Health, Heroism, and Limits"
916,Ashley and Tracey Humphrey Case Analysis (Murder of Sandra Rozzo)
917,"John E. Mack | UFO Physician | Life, Death, & Personality"
918,Andrew Gosden Disappearance | Lured Away from Safety?
919,Rockefeller Imposter | Christian Karl Gerhartsreiter Case Analysis
920,Pamela Hupp Case Analysis | Framing of Russell Faria
921,"Ammons Family ""Haunting"" Analysis | Successful Exorcism or Colossal Waste of Time?"
922,Cameron Herrin Case Analysis | Too Pretty for Prison?
923,"Alek Minassian Case Analysis | Autism Spectrum Disorder, Rejection Sensitivity, & Narcissism"
924,Phoebe Handsjuk Case Analysis | Garbage Chute Death
925,Jeff Pelley Case Analysis | Master Assassin or Innocent?
926,Tristyn Bailey Case Analysis | Is Aiden Fucci Guilty of Murder?
927,Kayak Killer (Angelika Graswald) | Pleading Guilty While Maintaining Innocence
928,Victoria's Secret Karen (Abigail Elphick) | Dangers of Having No Sense of Shame
929,Mercedes Homicide | Clara Harris Case Analysis
930,ACE Family Controversy | Pursuit of the Perfect Image
931,Kimberly Kessler Case Analysis | From Missing Person to Defendant
932,Michael Morton Case Analysis | Police and Prosecutor Misconduct
933,Lisa Harnum Case Analysis | Balcony Homicide
934,"Does John Edward Hear Messages from the Dead? | Analysis of ""Psychic"" Tactics"
935,Sophie Toscan du Plantier Case Analysis | Review of Sophie: A Murder in West Cork
936,Mark Winger Case Analysis | Framing an Innocent Man for Murder
937,"Moorish Sovereign Citizens Analysis | Who are ""Rise of the Moors"""
938,Robert Blake Case Analysis | Murder of Bonny Lee Bakley
939,"Did Oprah Winfrey Promote Pseudoscience? | Rise of Chopra, Oz, McGraw, Ray, Tolle, and McCarthy"
940,Christopher Coleman Case Analysis | Predecessor to Chris Watts
941,Karrie Neurauter | Father / Daughter Murder Team
942,Audrey Marie Hilley (Black Widow) Case Analysis | Was She a Histrionic Con Artist?
943,CreepShow Art / Emily Artful Controversy
944,Rebecca Schaeffer Case Analysis | Robert John Bardo | Celebrity Stalkers Who Murder
945,Steven Koecher Disappearance Analysis
946,"Tom and Eileen Lonergan | Inspiration for ""Open Water"""
947,Natalee Holloway Case Analysis | Who is Joran van der Sloot?
948,Larry McNabney / Laren Sims | Petty Crime to Homicide
949,"John McAfee Case Analysis | Con Artist, Dangerous Criminal, or Both?"
950,Britney Spears Conservator Controversy | Analysis of Statement to Judge
951,Susan Wright Case Analysis | Homicide or Self-Defense?
952,Ronnie O'Neal Case Analysis | Screaming One's Way to a Guilty Verdict
953,Daniel Wozniak Case Analysis | Framing One Victim as Killer of Another
954,Brian Shaffer Case Analysis | Most Mysterious Disappearance Case Ever?
955,"Cayley Mandadi Case Analysis | Drugs, Fall, Rough Sex, or Homicide?"
956,Austin Harrouff Case Analysis | First Break Psychosis
957,Anneliese Michel Case Analysis | Exorcism vs. Mental Health Treatment
958,Emma Walker Case Analysis | Football Player / Cheerleader Homicide
959,Thomas Markle / Meghan Markle Controversy
960,Brian Brimager Case Analysis | Murder in Paradise
961,Cosmo DiNardo Case Analysis | Bipolar vs. Schizophrenia vs. Schizoaffective
962,Sherri Tenpenny Covid Vaccine Magnetism Conspiracy Theory
963,Rachel Wade Case Analysis | Homicidal Teenage Love Triangle
964,"""End of Frenemies"" Analysis | Failure to Set Boundaries"
965,Gabbie Hanna Controversy | Are Gabbie's Statements Regarding ADHD Accurate?
966,Randy Stair Case Analysis | Animated Ghost Girl Delusion
967,Lori and Chad Daybell Update | Beliefs about the Apocalypse
968,"Todd Mullis ""Corn Rake Killer"" | Nature of Repeated Infidelity"
969,"Peter Popoff | How Did ""Profit Popoff"" Succeed Even After His Scam Was Exposed?"
970,"Kristen Gilbert ""Angel of Death"" | Borderline Personality and Violence"
971,Rebecca Coriam Case Analysis | Cruise Ship Disappearance
972,Chrissy Teigen Controversy | Cancel Culture or Legitimate Boycott?
973,Anthony Todt Case Analysis | Todt Family Murders
974,Amie Harwick Case Analysis | Victim of Long-Term Stalker?
975,Gwen Shamblin Lara | Pseudo-Christian Cult Leader or Weight Loss Pioneer?
976,Jaime Osuna Case Analysis | Remorseless Murderer
977,Sheila Davalloo Case Analysis | Love Triangle Cringe Killer
978,"""Friends"" Reunion Show Analysis | What Happened to Matthew Perry?"
979,Diego Sanchez / Joshua Fabia Controversy | New Age MMA Trainer
980,Luke Mitchell / Jodi Jones Case Analysis | Fascination with Death
981,"James Dean | Life, Death, & Personality | Was He Talented Enough to be a Legend?"
982,Deepak Chopra | Quantum Healing Guru
983,Joshua Powell Case Analysis | Disappearance of Susan Powell
984,"TanaCon Promoter on ""Dr. Phil"" | Fake Fame and Accountability"
985,Jodi Arias / Travis Alexander Relationship Analysis | Weaponizing Sex
986,"""Tic Tac"" UFO Sighting Update | Corroboration for Cmdr. David Fravor"
987,Suzanne Morphew Disappearance
988,Trey Sesler (Mr. Anime) Case Analysis | Deep Desire to be a Killer
