,Title,PublishedDate,Views,Likes,Comments,Description,Month,Channel
0,The Unspeakable Murder of Savanna Greywind,2023-05-11,158224,7679,1352,"An examination of the murder of Savanna Greywind, and the interrogations of Brooke Crews (her murderer) and Will Hoehn (involvement open to debate)

TWITTER: https://twitter.com/RealMattOrchard | PATREON: https://www.patreon.com/MattOrchard | REDDIT: https://www.reddit.com/r/MattOrchard | DISCORD: https://discord.gg/VfUCy8FK9t | Paypal/Contact: MOCrimeAndSociety@gmail.com

Thumbnail Credit: Alex, Channel here: https://www.youtube.com/c/FrankRandom/videos",May,Matt Orchard - Crime and Society
1,This is What a Lazy-Bones Looks Like | Cart Narcs Documentary,2023-04-01,119127,10324,2885,"An explanation of the epidemic of loose shopping carts, and the organization fighting to hold those responsible to account. Special thanks to The Cart Narcs: https://www.youtube.com/@CartNarcs  

This video was a Patreon exclusive for about a year. It was released publicly on April 1st, 2023 with the tag ""JCS Inspired."" Another crime feature is currently in the works  :)

TWITTER: https://twitter.com/RealMattOrchard | PATREON: https://www.patreon.com/MattOrchard | REDDIT: https://www.reddit.com/r/MattOrchard | DISCORD: https://discord.gg/VfUCy8FK9t | Paypal/Contact: MOCrimeAndSociety@gmail.com",Apr,Matt Orchard - Crime and Society
2,The Darrell Brooks Show,2023-03-01,312609,11950,3663,"A look at the trial of Darrell Brooks, as well as some of the fringe schools of thought that underpinned some of the arguments he attempted to present.

0:00 Patreon Pitch
0:30 Primer on SovCits (Recommended)
12:00 Darrell Brooks

TWITTER: https://twitter.com/RealMattOrchard | PATREON: https://www.patreon.com/MattOrchard | REDDIT: https://www.reddit.com/r/MattOrchard | DISCORD: https://discord.gg/VfUCy8FK9t | Paypal/Contact: MOCrimeAndSociety@gmail.com


Thumbnail Credit: Alex, Channel here: https://www.youtube.com/c/FrankRandom/videos",Mar,Matt Orchard - Crime and Society
3,The Scott Peterson Affair,2022-12-24,343022,13163,3044,"A look at the case of Scott Peterson, who was convicted for the murder of his wife, Laci Peterson, who went missing on Christmas Eve, 2002.

TWITTER: https://twitter.com/RealMattOrchard | PATREON: https://www.patreon.com/MattOrchard | REDDIT: https://www.reddit.com/r/MattOrchard | DISCORD: https://discord.gg/VfUCy8FK9t | Paypal/Contact: MOCrimeAndSociety@gmail.com

Spoilers below…

Special thanks to Tabitha Kent, whose blog Crime Piper can be found here: https://crimepiperblog.wordpress.com/
And she’s on Twitter here: https://twitter.com/TabbyKent

Tabitha has been thoroughly covering this case pretty much since everything went down for no money and not nearly enough thanks. There were so many details to keep track of when trying to put this together that I can confidently say without her help navigating all the raw sources and fielding dozens of questions, I would not have been able to complete the project on time. So if you enjoyed the video, it’d be great for you to visit her blog and let her know how much she’s appreciated 🙂

Some might say her involvement demonstrates bias or something. No doubt this video is unapologetically bias, but just for what it’s worth, Tabitha was brought on to help after I felt I had formed my own opinion on the case. As I say, it was getting all the little details right and saving me hours worth of time scrounging around for answers to niggly questions where she lent her invaluable hand. 

Thumbnail Credit: Alex, Channel here: https://www.youtube.com/c/FrankRandom/videos

More on Polygraphs: https://youtu.be/JYYQT4sqVgs
More on Memory: https://youtu.be/lnAwAhC7JLU -- Mainly about the debate around “repressed memories” but it’s got a fair bit about faulty memories in general.",Dec,Matt Orchard - Crime and Society
4,He Who Defends Himself: The Legal Manoeuvres of Trevor Summers,2022-11-10,288223,10701,2081,"A look at the case, and self-defense approach of Trevor Summers | Keep exploring at http://brilliant.org/MattOrchard/  Get started for free, and hurry—the first 200 people get 20% off an annual premium subscription.

TWITTER: https://twitter.com/RealMattOrchard | PATREON: https://www.patreon.com/MattOrchard | REDDIT: https://www.reddit.com/r/MattOrchard | DISCORD: https://discord.gg/VfUCy8FK9t | Paypal/Contact: MOCrimeAndSociety@gmail.com

Thumbnail Credit: Alex, Channel here: https://www.youtube.com/c/FrankRandom/videos

This video was sponsored by Brilliant",Nov,Matt Orchard - Crime and Society
5,The Strange Psychology of Russell Williams,2022-09-22,490020,12721,2538,"An in depth look at one of Canada’s worst criminals in recent history, (former) Col. Russell Williams

TWITTER: https://twitter.com/RealMattOrchard | PATREON: https://www.patreon.com/MattOrchard | REDDIT: https://www.reddit.com/r/MattOrchard | DISCORD: https://discord.gg/VfUCy8FK9t | Paypal/Contact: MOCrimeAndSociety@gmail.com 

Full Prosecution Opening: https://youtu.be/Ce2bmpDSg1g

Thumbnail Credit: Alex, Channel here: https://www.youtube.com/c/FrankRandom/videos",Sep,Matt Orchard - Crime and Society
6,How Chandler Halderson Didn't Come Close to Getting Away with Murder,2022-07-14,565787,16342,3555,"A look at the case of Chandler Halderson - one of the most inept murder coverup attempts in recent memory | Atlas VPN Deal: https://get.atlasvpn.com/MattOrchard

TWITTER: https://twitter.com/RealMattOrchard | PATREON: https://www.patreon.com/MattOrchard | REDDIT: https://www.reddit.com/r/MattOrchard | Paypal/Contact: MOCrimeAndSociety@gmail.com

Full Prosecution Opening: https://youtu.be/Ce2bmpDSg1g

Thumbnail Credit: Alex, Channel here: https://www.youtube.com/c/FrankRandom/videos",Jul,Matt Orchard - Crime and Society
7,The Weird World of Cults,2022-06-09,230956,11232,1979,"An examination of the phenomenon of cults, that uses case studies of Scientology, Heaven’s Gate and NXIVM.

TWITTER: https://twitter.com/RealMattOrchard | PATREON: https://www.patreon.com/MattOrchard | REDDIT: https://www.reddit.com/r/MattOrchard | Paypal/Contact: MOCrimeAndSociety@gmail.com

Special thanks to Sawyer and his partner Cathy who were kind enough to correspond with me about the Heaven’s Gate stuff and provide their perspective. Sawyer is an original HG member (or close enough to it). Class was in session a bit before Cathy’s time, so she was never a part of all of it in person, but came to be a strong believer from looking at their online materials. They have a channel where they discuss their beliefs and comment on HG tapes which you can check out here: https://www.youtube.com/c/3spmSwy

If you do go and say hi, make sure to BE NICE! They may look at the world very, very differently but they took the time to answer questions and explain their beliefs as best they could, even though they knew the final product wasn't going to be pro HG. I really appreciate them for that, and it'd be great if you let them know you do too. 

Special thanks also to Leo Helmar who’s very well read on NXIVM and Scientology and was kind enough to review the script for me. Leo has a channel that has been quiet for a while, but he plans on doing video essays on high control groups in the near future so chuck him a sub if you’re into this sort of subject: https://youtube.com/channel/UCOkvzmUIPfQYcOTawWL_M2Q",Jun,Matt Orchard - Crime and Society
8,Johnny and Amber: A Love Story,2022-04-21,192282,8009,2060,"An exploration of the turbulent relationship of Johnny Depp and Amber Heard, and some of the core allegations and evidence at the heart of their legal dispute. 

TWITTER: https://twitter.com/RealMattOrchard | PATREON: https://www.patreon.com/MattOrchard | REDDIT: https://www.reddit.com/r/MattOrchard | Podcast: The Week In Brief (Apple, Spotify, most other places) | Paypal/Contact: MOCrimeAndSociety@gmail.com

For further reading on the case the main resource would be the full court transcripts: https://www.nickwallis.com/depp-trial-court-transcripts

A website called Depp Dive also has archived pretty much every pic, audio and video associated with the case, plus a lot more: https://deppdive.net/

This video covers the case UP TO the trial in Fairfax. If you want to get into the happenings at Fairfax, channels like Law & Crime are streaming the full thing and a bunch of streamers are covering it also.

One channel I’ve seen some good daily summaries from is LegalBytes: https://www.youtube.com/c/LegalBytesMedia/videos

Full DIY marriage counseling audio: 
https://www.youtube.com/watch?v=k9pbrBmHI58

--ALL RESOURCES PAST THIS POINT ARE EXPLICITLY DEPP SYMPATHETIC--

…and that’s not necessarily a bad thing, just thought it was worth disclosing. If there were Heard sympathetic podcasts/channels I'd come across then I would share them. Feel free to recommend any.

IncrediblyAverage (where the Aus tape came from): https://www.youtube.com/channel/UCg0C-N_MPYYOXyF4T3jMxNQ/videos

A podcast called “Movie Myths and Monsters” has done an extensive series going through case evidence, court transcripts, etc. and will surely be doing coverage of Fairfax too.",Apr,Matt Orchard - Crime and Society
9,How Dennis Oland (probably) Got Away With Murder,2022-02-17,328987,11769,1725,"A look at the murder of prominent Canadian businessman, Richard Oland, and the case against the prime suspect, his son, Dennis Oland | Get the exclusive NordVPN deal here: https://NordVPN.com/mattorchard. It’s risk free with Nord’s 30 day money-back guarantee! Thanks to NordVPN for sponsoring this video.

TWITTER: https://twitter.com/RealMattOrchard | PATREON: https://www.patreon.com/MattOrchard | REDDIT: https://www.reddit.com/r/MattOrchard/ | Paypal/Contact: MOCrimeAndSociety@gmail.com | Get the exclusive NordVPN deal here: https://NordVPN.com/mattorchard",Feb,Matt Orchard - Crime and Society
10,The Endless Riddle of JonBenét Ramsey,2021-12-26,1075301,26943,11341,"The killing of JonBenét Ramsey remains one of the most infamous unsolved crimes of the past century. This video unpacks some of the most popular theories of who the culprit was. Namely: The Parents (RDI - Ramseys Did It), The Brother (BDI - Burke Did It), or an Intruder (IDI - Intruder Did It)

TWITTER: https://twitter.com/RealMattOrchard | PATREON: https://www.patreon.com/MattOrchard | REDDIT: https://www.reddit.com/r/MattOrchard/ | Paypal/Contact: MOCrimeAndSociety@gmail.com

Thumbnail Credit:

Alex - Channel here: https://www.youtube.com/c/FrankRandom/videos

Ransom note read by Bonniekiwi: https://www.fiverr.com/bonniekiwi
For further reading there are a virtually endless amount of resources on the case, but this video was mainly informed by the following books:

JonBenet: Inside the Ramsey Murder Investigation by Steve Thomas (RDI - Patsy) - https://www.amazon.com/JonBenet-Inside-Ramsey-Murder-Investigation/dp/1250054796

Foreign Faction by James Kolar (BDI) - https://www.amazon.com/Foreign-Faction-Really-Kidnapped-JonBenet/dp/098476321X

We Have Your Daughter by Paula Woodward (IDI) - https://www.amazon.com/We-Have-Your-Daughter-Unsolved/dp/1632260778

Injustice: Why JonBenet Ramsey Was Murdered By A Sadistic Psychopath - Not Her Parents by Robert A. Whitson (IDI) - https://www.amazon.com/Injustice-JonBenet-Murdered-Sadistic-Psychopath/dp/1475074824

Ruled IN: Solving the JonBenet Ramsey Case by DocG (RDI - John) - https://www.amazon.com/dp/B00HNWYIEM


Special Thanks:

Michael A.

Becky Davenport

searchinGirl (website: searchingirl.com)

Darlene Rowlands 

The Reddit communities of r/JonBenetRamsey and r/JonBenet",Dec,Matt Orchard - Crime and Society
11,The Scandalous Saga of Anthony Weiner,2021-10-27,314746,13872,2770,"A look at the seemingly endless downfall of former congressman, Anthony Weiner.

TWITTER: https://twitter.com/RealMattOrchard | PATREON: https://www.patreon.com/MattOrchard | REDDIT: https://www.reddit.com/r/MattOrchard/ | Paypal/Contact: MOCrimeAndSociety@gmail.com

Thumbnail Credit:

Alex of The History Report (Channel here: https://www.youtube.com/c/TheHistoryReport)

Cameo Credit [Tiny Spoiler]:

You’ll notice a couple of different voices pop up around the 43 min mark.

The reporter is In Human Form. IHF is a great video essayist who has made some JCS-esque interrogation breakdowns everyone is bound to enjoy. For those of you that are also into politics/philosophy, he has branched out into Adam Curtis influenced documentaries. Really high end production and I think his channel is a real hidden gem on this platform. Check him out here: https://www.youtube.com/c/Inhumanform/videos

The Governor is Scribe Light. Scribe does all kinds of stuff and is probably best known for making fun of TedX Talks. He has recently started taking on true crime stories, which subscribers of this channel will likely be most interested in. His latest effort is very well put together, give it a look! https://www.youtube.com/watch?v=dzdRrAvxUs4",Oct,Matt Orchard - Crime and Society
12,The Predators,2021-09-23,265466,14559,4137,"A look at the origins and evolution of “Predator Poachers” from To Catch A Predator to...well, a lot of other people. 

Special thanks to JCS on this one for sort of unintentionally convincing me to push forward with it when I was really struggling and just about to drop it

TWITTER: https://twitter.com/RealMattOrchard | PATREON: https://www.patreon.com/MattOrchard | REDDIT: https://www.reddit.com/r/MattOrchard/ | Paypal/Contact: MOCrimeAndSociety@gmail.com",Sep,Matt Orchard - Crime and Society
13,"Denise Williams' Horrible, No Good, Very Bad Day",2021-08-26,529865,18609,2927,"In December of the year 2000, Denise Williams’ husband, Mike, vanished and was presumed to have drowned. But the real truth was much more sinister.

TWITTER: https://twitter.com/RealMattOrchard | PATREON: https://www.patreon.com/MattOrchard | REDDIT: https://www.reddit.com/r/MattOrchard/ | Paypal/Contact: MOCrimeAndSociety@gmail.com",Aug,Matt Orchard - Crime and Society
14,The Memory Wars,2021-07-29,208901,9708,1735,"A look at the heated debate around the validity of repressed and recovered memories. 

TWITTER: https://twitter.com/RealMattOrchard | PATREON: https://www.patreon.com/MattOrchard | REDDIT: https://www.reddit.com/r/MattOrchard/ | Paypal/Contact: MOCrimeAndSociety@gmail.com",Jul,Matt Orchard - Crime and Society
15,The Only One Who Deserved to Stay - The Case of David Bain,2021-06-23,355067,15539,2759,"The Bain Family Homicides remains one of the most infamous and divisive crime stories in New Zealand. This video explores some of the key reasons why that's so.

TWITTER: https://twitter.com/RealMattOrchard | PATREON: https://www.patreon.com/MattOrchard | REDDIT: https://www.reddit.com/r/MattOrchard/ | Paypal/Contact: MOCrimeAndSociety@gmail.com

Music:

“Family Portrait Revisited” by Kool Aid.
Bandcamp: https://koolaidnz.bandcamp.com

Thumbnail Credit: Alex @ The History Report. Channel here: https://www.youtube.com/c/TheHistoryReport/videos

Explanation for the 16 years thing (SPOILERS):

There isn’t much of one really. New Zealand’s justice system has less of an emphasis on punishment than other countries, and we don’t do consecutive sentences - so you don’t see those Holtzclaw-esque centuries long prison terms. Bain was relatively young, had no prior history and 16 years is actually getting up there in terms of what you see handed down for serious crimes - this was especially so at the time.

[MORE SPOILERS, don't keep going if you haven't finished the video]

One thing to bear in mind before getting TOO outraged at how lax we are: A minimum non-parole period is just that, a minimum. So once his 16 years were up, if he was still deemed a danger he could be kept inside, and there is no maximum as to how long they could extend his prison stay. Though in Bain’s case he likely would have gotten out around the time his term was up due to how controversial the case was. Lifers who get parole are also on probation til the day they die...Cold comfort for anyone who might be victimized by them if they re-offend, of course.

Life without parole is not something that is categorically off the table in any circumstance. We have handed that down ONCE and it was very recently. The Christchurch Mosque Shooter will never see the light of day again. Harshest sentence ever before that was 30 years.If you’re of the opinion cold blooded murderers should be given life without parole basically by default, there are plenty of Kiwis who agree with you.",Jun,Matt Orchard - Crime and Society
16,George Floyd and Derek Chauvin - As it Happened and How it was Argued,2021-05-13,157044,9537,3919,"An analysis of the trial of Derek Chauvin for the murder of George Floyd, and the incident itself. Viewer discretion is advised. 


TWITTER: https://twitter.com/RealMattOrchard | PATREON: https://www.patreon.com/MattOrchard | REDDIT: https://www.reddit.com/r/MattOrchard/ | Paypal/Contact: MOCrimeAndSociety@gmail.com",May,Matt Orchard - Crime and Society
17,The Coldest Case Ever Solved,2021-04-01,2065072,67695,8399,"On December 3rd, 1957, 7-year-old Maria Ridulph was abducted from outside her home in the small town of Sycamore, Illinois. 55 years later, the culprit was finally convicted. 

TWITTER: https://twitter.com/RealMattOrchard | Patreon: https://www.patreon.com/MattOrchard | Paypal/Contact: MOCrimeAndSociety@gmail.com

Thumbnail Credit:

Alex of The History Report (Channel here: https://www.youtube.com/c/TheHistoryReport)",Apr,Matt Orchard - Crime and Society
18,The Lie of the Polygraph,2021-02-07,261932,12403,2131,"The polygraph has gained a reputation in popular culture as the quintessential lie detector. This video seeks to illustrate how undeserved that reputation is.

TWITTER: https://twitter.com/RealMattOrchard | Patreon: https://www.patreon.com/MattOrchard | Paypal/Contact: MOCrimeAndSociety@gmail.com

Special Thanks:

Doug Williams - More info at Polygraph.com

George W. Maschke of AntiPolygraph.org

Thumbnail Credit: Alex of The History Report (Channel here: https://www.youtube.com/c/TheHistoryReport)

Audio Mastering: Alec Armbruster

Further Reading:

False Confessions: The True Story of Doug Williams and His Crusade Against the Polygraph Industry by Jack Straw and Doug Williams: https://www.amazon.com/False-Confessions-Williams-Polygraph-Industry/dp/0578230372


How To Sting the Polygraph by Doug Williams: https://polygraph.com/sting-the-polygraph.html

Plus reams of information at https://www.AntiPolygraph.org",Feb,Matt Orchard - Crime and Society
19,The Curious Case of Sandy Melgar,2020-12-25,412949,14824,3751,"An exploration of the very strange murder of Jaime Melgar, which his wife Sandy was convicted for in 2017. Questions remain…

Patreon: https://www.patreon.com/MattOrchard
Twitter: https://twitter.com/RealMattOrchard",Dec,Matt Orchard - Crime and Society
20,A Tale of Two Narcissists: The Downfalls of Ted Haggard and John Edwards,2020-11-21,544692,18369,4298,"An exploration of pastor Ted Haggard and politician John Edwards, specifically their spectacular falls from grace in the mid to late 2000s 

TWITTER: https://twitter.com/RealMattOrchard | Patreon: https://www.patreon.com/MattOrchard | PayPal: MOCrimeAndSociety@gmail.com",Nov,Matt Orchard - Crime and Society
21,Psychology of a Douchebag: The Case of Basil Borutski,2020-09-20,433145,11735,2591,"Basil Basil Borutski is equal parts monstrous and dull, making this a true crime video that should be uniquely difficult to get through.

TWITTER: https://twitter.com/RealMattOrchard | Patreon: https://www.patreon.com/MattOrchard | PayPal: MOCrimeAndSociety@gmail.com",Sep,Matt Orchard - Crime and Society
22,Hot Seat: The Case of Justin Ross Harris,2020-08-30,993921,20015,8273,"And exploration of the death of Cooper Harris and the ultimate murder conviction of his father, Justin Ross Harris. 

UPDATE: On 06/22/22 JRH's murder conviction was overturned by the The Georgia Supreme Court. The short version is [SPOILER ALERT] that the court found the evidence pertaining to his extramarital affairs was unfairly prejudicial. The likely outcome will be that Harris will receive a new trial without the philandering stuff being brought in. 

PATREON: https://www.patreon.com/MattOrchard | TWITTER: https://twitter.com/RealMattOrchard | REDDIT: https://www.reddit.com/r/MattOrchard | Paypal/Contact: MOCrimeAndSociety@gmail.com 

This one is hard to watch, which is saying something coming from the guy who didn’t feel the need to say that about the Holtzclaw video. All the same, I hope you enjoy it!",Aug,Matt Orchard - Crime and Society
23,The Highly Controversial Case of Daniel Holtzclaw,2020-08-11,448240,20054,7642,"TWITTER: https://twitter.com/RealMattOrchard | Patreon: https://www.patreon.com/MattOrchard | PayPal: MOCrimeAndSociety@gmail.com

Sorry this video has taken so long. I hope all the people who enjoyed the previous two Jim Can’t Swim style vids find that it’s worth the wait. This is still definitely in the mould of JCS but also beginning to drift toward my own inclinations in a way that I hope fans find strikes a good balance. 

MUSIC:
“All Aboard for Oklahoma” by Spade Cooley: https://www.youtube.com/watch?v=8HocKKLxVWM
""King Of Oklahoma” by Michael Franks: https://www.youtube.com/watch?v=Vx8bwncmx74",Aug,Matt Orchard - Crime and Society
24,The Case of Anthony Palma (Jim Can't Swim Imitation),2020-07-04,1245491,26023,5018,"UPDATE: Thanks so much for all the positive feedback and subs! The next video on the Holtzclaw case has taken over my life and is going to be GIGANTIC. As a result it's a bit delayed but should be up within about a week. Stay tuned!
---

After I made a parody video, JCS actually commissioned me to try making the real thing. Unfortunately it wasn't quite the right fit for them (no bad blood, awesome guys!) but here's the final product, hopefully fans like it!

I've got at least one more JCS style vid on the way that will be an order of magnitude higher end than this rather ""back to basics"" project and it will be on the Daniel Holtzclaw case. If that sounds appealing, make sure to subscribe and hit that notification bell. I have a stretch target for the 20th but it will certainly be no later than the end of the month.

TWITTER: https://twitter.com/RealMattOrchard | Patreon: https://www.patreon.com/MattOrchard | PayPal: MOCrimeAndSociety@gmail.com",Jul,Matt Orchard - Crime and Society
25,The Case of Denis Leary on Tough Crowd (Jim Can’t Swim Parody),2020-05-19,227772,7730,1311,"UPDATE: So the JCS guys saw this and liked it so much they gave me the opportunity to try making the real thing! Check it out here: https://www.youtube.com/watch?v=VOUEiLTQnLE - I'm making at least one more straight imitation about the Holtzclaw case which I'm planning on really taking to the next level so def subscribe if you're keen to see that when it's ready. Thanks so much to everyone who left kind comments, it was really encouraging :)


---



To work on my video editing skills I made a break down on Greg Giraldo’s legendary shellacking of Denis Leary on Tough Crowd w/ Colin Quinn in the style of a JCS criminal profiling video. My Kizzume impression is a little scratchy, but it's a start.


I hope fans of JCS and/or Giraldo enjoy it and if you have recommendations for other videos that might work with the format, please let me know! 



Credit for Hicks/Leary comparison video: https://www.youtube.com/user/badmotherfuckerer",May,Matt Orchard - Crime and Society
26,Old Crow Medicine Show - Brushy Mountain Conjugal Trailer (Not Fake!),2014-06-03,175760,821,81,I saw a few fake vids for the new Old Crow track so I thought I'd upload the real thing for fans. I DO NOT OWN THE COPYRIGHT FOR THIS TRACK. Encourage everyone to buy the album when it's out!,Jun,Matt Orchard - Crime and Society
